id;conversation_id;created_at;date;time;timezone;user_id;username;name;place;tweet;language;mentions;urls;photos;replies_count;retweets_count;likes_count;hashtags;cashtags;link;retweet;quote_url;video;thumbnail;near;geo;source;user_rt_id;user_rt;retweet_id;reply_to;retweet_date;translate;trans_src;trans_dest
1,27767E+18;1,27766E+18;2020-06-29 20:11:58 Střední Evropa (letní čas);29.06.2020;20:11:58;200;1,23849E+18;delife_29;Daniel ''Delife'' Mik;;@ZdravkoOnline Protože korona chodí v noci 😂😂😂 výborně! Jako vždy jste se opět předvedli...;cs;[];[];[];0;0;6;[];[];https://twitter.com/Delife_29/status/1277666133135499264;NEPRAVDA;;0;;;;;;;;[{'screen_name': 'ZdravkoOnline', 'name': 'Ministerstvo zdravotnictví', 'id': '3293937255'}];;;;
1,27762E+18;1,27761E+18;2020-06-29 17:15:15 Střední Evropa (letní čas);29.06.2020;17:15:15;200;1883298006;vyplynuloto;El🦊;;@prominzeziju my jsme byly 3 měsíce rozesazeny po 1  a pak prisla korona jinak by to tak bylo az do konce roku 😂... ve druháku;cs;[];[];[];1;0;1;[];[];https://twitter.com/vyplynuloto/status/1277621661110542337;NEPRAVDA;;0;;;;;;;;[{'screen_name': 'prominzeziju', 'name': 'denis', 'id': '1097625790613766144'}];;;;
1,27753E+18;1,27747E+18;2020-06-29 11:06:40 Střední Evropa (letní čas);29.06.2020;11:06:40;200;7,95261E+17;chyba_systemu;Chyba Systému;;@jana_julie Ten koronavirus létání dost ztížil ... 🤔😂😂😂;cs;[];[];[];1;0;1;[];[];https://twitter.com/chyba_systemu/status/1277528903465209857;NEPRAVDA;;0;;;;;;;;[{'screen_name': 'jana_julie', 'name': 'JJG Schrödinger 🇺🇦', 'id': '1265915010095747073'}];;;;
1,27752E+18;1,27752E+18;2020-06-29 10:19:04 Střední Evropa (letní čas);29.06.2020;10:19:04;200;1296593671;jperuska;Jan Pěruška;;Wow, korona “eeehm... eeeehm...” tiskovky jsou zpět 👀🔝😍;cs;[];[];[];0;0;0;[];[];https://twitter.com/JPeruska/status/1277516926252658690;NEPRAVDA;;0;;;;;;;;[];;;;
1,27737E+18;1,27737E+18;2020-06-29 00:27:54 Střední Evropa (letní čas);29.06.2020;0:27:54;200;2400562754;sssirda;Michal Sirový ⚫️ ⬛️;;Tohle je účast v parlamentních volbách 2019, kdy byla o chlup menší účast. 60+ lidi měli o dost větší účast než teď.👇  To by byl pro Babiše opravdu průšvih. Navíc může přijít další vlna koronaviru a senioři tím spíš nedorazí. ✅  Tak ho nakonec neporazí opozice, ale pandemie. 🙈  https://t.co/qXge1eyN3e;cs;[];[];['https://pbs.twimg.com/media/Eboe776XYAgMuqX.png'];3;1;18;[];[];https://twitter.com/sssirda/status/1277368150749831168;NEPRAVDA;;1;https://pbs.twimg.com/media/Eboe776XYAgMuqX.png;;;;;;;[];;;;
1,27731E+18;1,27731E+18;2020-06-28 20:54:07 Střední Evropa (letní čas);28.06.2020;20:54:07;200;8,87345E+17;miroslavsuta;Miroslav Šuta;;Dramatický vzestup počtu nových případů #COVID19 nelze vysvětlovat počtem testů. Dramatický poměr pozitivních testů nás vrací do situace z března 😒 #koronavirus #COVID19cz #Czechia #coronavirus #SARSCoV2  https://t.co/kOOg3b2qEx;cs;[];[];['https://pbs.twimg.com/media/EbntRZWWoAEw3W9.jpg'];0;0;6;['covid19', 'koronavirus', 'covid19cz', 'czechia', 'coronavirus', 'sarscov2'];[];https://twitter.com/MiroslavSuta/status/1277314351108669440;NEPRAVDA;;1;https://pbs.twimg.com/media/EbntRZWWoAEw3W9.jpg;;;;;;;[];;;;
1,27725E+18;1,27725E+18;2020-06-28 16:31:14 Střední Evropa (letní čas);28.06.2020;16:31:14;200;2546496654;rozkvetlalouka;natalie;;Jako já jsem myslela, že když je koronavirus, tak je centrum Prahy prázdné a ne, že se nedá pomalu projít 😳;cs;[];[];[];0;0;3;[];[];https://twitter.com/rozkvetlalouka/status/1277248194930528257;NEPRAVDA;;0;;;;;;;;[];;;;
1,27724E+18;1,2772E+18;2020-06-28 15:53:48 Střední Evropa (letní čas);28.06.2020;15:53:48;200;1,13631E+18;francovarenata;Renáta Francová;;@NE_uro_chir_urg U nás teď převládá názor, že koronavirus neexistuje 🙊🙉a tím byla definitivně vyřešena otázka odměn 🤡;cs;[];[];[];0;0;1;[];[];https://twitter.com/FrancovaRenata/status/1277238775396130819;NEPRAVDA;;0;;;;;;;;[{'screen_name': 'NE_uro_chir_urg', 'name': 'Skylocephalus (ψ hlava)', 'id': '949373802852610048'}];;;;
1,27715E+18;1,27715E+18;2020-06-28 10:15:20 Střední Evropa (letní čas);28.06.2020;10:15:20;200;1,24684E+18;misapodhraska;8🤍;;Kdyz vis, ze nebudes moct jit na prvni retro po korone : 😭😭😭😭😭;cs;[];[];[];0;1;1;[];[];https://twitter.com/misapodhraska/status/1277153595436290049;NEPRAVDA;;0;;;;;;;;[];;;;
1,27714E+18;1,27679E+18;2020-06-28 09:02:00 Střední Evropa (letní čas);28.06.2020;9:02:00;200;1,18086E+18;zuzanas12;ZuzanaS.🇺🇦;;@Ivana38081184 😂👍 od doby co ta ministerstva řídí víceministr, tak o nich pomalu není slechu. Ten koronavirus je pro ně dar z nebes, nemusí informovat kolik se postavilo a opravilo dálnic a jak pokračuje příprava D-O-L🤣;cs;[];[];[];0;0;1;[];[];https://twitter.com/ZuzanaS12/status/1277135141249392641;NEPRAVDA;;0;;;;;;;;[{'screen_name': 'Ivana38081184', 'name': 'Ivana', 'id': '797484978108071936'}];;;;
1,27692E+18;1,27692E+18;2020-06-27 18:58:16 Střední Evropa (letní čas);27.06.2020;18:58:16;200;3306740907;ufleku2;ufleku;;#Groundhopping  Spiel 3 Korona Cup Skupina Usti nad Labem FK Jílové vs TJ Svadov Olsinky  30 Kronen Eintritt  60 Zuschauer davon 6 Dynamo Fans mit Rad aus Dresden 😱  https://t.co/eaaYaBl1W9;cs;[];[];['https://pbs.twimg.com/media/EbiKgFNX0AAfwaJ.jpg', 'https://pbs.twimg.com/media/EbiKgFJWkAAWRuc.jpg', 'https://pbs.twimg.com/media/EbiKgGDWsAE7jRy.jpg', 'https://pbs.twimg.com/media/EbiKgHVX0AEc2gD.jpg'];0;0;9;['groundhopping'];[];https://twitter.com/ufleku2/status/1276922808140955654;NEPRAVDA;;1;https://pbs.twimg.com/media/EbiKgFNX0AAfwaJ.jpg;;;;;;;[];;;;
1,27685E+18;1,27685E+18;2020-06-27 14:28:22 Střední Evropa (letní čas);27.06.2020;14:28:22;200;1,19678E+18;dvorakovanada;Naďa Dvořáková;;😟😟😥 Koronavirus zůstává. 168 nových případů v Česku. Nová data o nemoci  https://t.co/cnrKtbXp6J via @SeznamZpravy;cs;[{'screen_name': 'seznamzpravy', 'name': 'seznam zprávy', 'id': '723053842267398144'}];['https://www.seznamzpravy.cz/clanek/koronavirus-zustava-168-novych-pripadu-v-cesku-nova-data-o-nemoci-109285#utm_source=twitter&utm_medium=sharebt&utm_campaign=top'];[];0;0;2;[];[];https://twitter.com/DvorakovaNada/status/1276854884789354496;NEPRAVDA;;0;;;;;;;;[];;;;
1,27659E+18;1,27659E+18;2020-06-26 20:51:29 Střední Evropa (letní čas);26.06.2020;20:51:29;200;1,0555E+18;jakubchytil5;Jakub Chytil;;Koronavirus umí zázraky. Města jako Frýdek, Karviná, Šumperk, Kroměříž jsou na mapě někde úplně jinde. Ale co, je to jen Morava že?😂;cs;[];[];[];0;0;1;[];[];https://twitter.com/JakubChytil5/status/1276588914095071234;NEPRAVDA;https://twitter.com/SeznamZpravy/status/1276575957705506818;0;;;;;;;;[];;;;
1,2764E+18;1,2764E+18;2020-06-26 08:39:59 Střední Evropa (letní čas);26.06.2020;8:39:59;200;78560477;9sirtom5;Sirtom Hardcore 🏴;;Lidi v první linii zahnali koronavirus. Za odměnu přijdou o peníze #nášstát 😍  https://t.co/QUTpCxuk2i;cs;[];['https://echo24.cz/a/SpPNs/lidi-v-prvni-linii-zahnali-koronavirus-za-odmenu-prijdou-o-penize?fbclid=IwAR2ZkPr21-rtP6SfT5_jP6FJygcSQNE3F59UuQH_wpMIcqERB59imZigv08'];[];0;1;2;['nášstát'];[];https://twitter.com/9sirtom5/status/1276404825362780161;NEPRAVDA;;0;;;;;;;;[];;;;
1,2764E+18;1,2764E+18;2020-06-26 08:25:23 Střední Evropa (letní čas);26.06.2020;8:25:23;200;1,26379E+18;ecoplagroup;ECOPLA GROUP;;Doba koronavirová je téměř za námi. 😷  Aktuálně se svět zaměřuje na ekonomickou krizi. 💸 Kdy přijde naše chvíle? ♻️ . . . . . #ecopla #koronavirus #ekonomickakrize #zmenaklimatu #ekologie #recyklace #plastovyodpad #reuse  https://t.co/sx1CNMEJyR;cs;[];[];['https://pbs.twimg.com/media/EbawFEhXgAEUWFu.jpg'];0;0;0;['ecopla', 'koronavirus', 'ekonomickakrize', 'zmenaklimatu', 'ekologie', 'recyklace', 'plastovyodpad', 'reuse'];[];https://twitter.com/Ecoplagroup/status/1276401151802593280;NEPRAVDA;;1;https://pbs.twimg.com/media/EbawFEhXgAEUWFu.jpg;;;;;;;[];;;;
1,27605E+18;1,27605E+18;2020-06-25 09:16:22 Střední Evropa (letní čas);25.06.2020;9:16:22;200;107385141;adrianacerna;Adriana Černá 🇺🇦;;S prvními týdny pandemie jsme začali sledovat lži, které se o koronaviru šíří. S koncem lock-downu už byl hotový výukový materiál pro užití nejen na školách.   Dostat poznatky z praxe do výuky už rychleji a efektivněji snad ani nejde 😊   ➡️  https://t.co/3PgPlGQPBq  https://t.co/V5Cf1kGyzI;cs;[];['https://www.clovekvtisni.cz/dezinformacni-dezinfekce-aneb-jak-na-koronavirove-dezinformace-6836gp'];['https://pbs.twimg.com/media/EbVx56hXYAApwbJ.png'];0;6;59;[];[];https://twitter.com/AdrianaCerna/status/1276051593981579264;NEPRAVDA;;1;https://pbs.twimg.com/media/EbVx56hXYAApwbJ.png;;;;;;;[];;;;
1,27589E+18;1,27589E+18;2020-06-24 22:20:12 Střední Evropa (letní čas);24.06.2020;22:20:12;200;751094587;pavlakublkov;Pavla Kubálková;;Dvě ⭐️⭐️ na dresu 😍 Naprosto zaslouženě za celou sezónu! Nezastaví vás ani korona, ani nadstavba 😀 Díky @slaviaofficial za tu radost ❤️🔴⚪️  #mistri #mistrligy #skslaviapraha  https://t.co/00AHHwJ7XP;cs;[{'screen_name': 'slaviaofficial', 'name': 'sk slavia praha 🏆🏆🏆', 'id': '523168435'}];[];['https://pbs.twimg.com/media/EbTb-ZNXYAYtoar.jpg'];1;0;79;['mistri', 'mistrligy', 'skslaviapraha'];[];https://twitter.com/PavlaKublkov/status/1275886465252298752;NEPRAVDA;;1;https://pbs.twimg.com/media/EbTb-ZNXYAYtoar.jpg;;;;;;;[];;;;
1,2758E+18;1,27315E+18;2020-06-24 16:33:55 Střední Evropa (letní čas);24.06.2020;16:33:55;200;4841535491;johanjagan;Jagan;;@IvcaProchajda Jasne to ma politicky podtext.Koronavirus se dohodl s Babisem, ze hospody zaviraji moc pozde, a uderil na Magistrate.👍🏽👍🏽😂Tohle proste nevymyslis.🙉;cs;[];[];[];0;0;5;[];[];https://twitter.com/JohanJagan/status/1275799319556296704;NEPRAVDA;;0;;;;;;;;[{'screen_name': 'IvcaProchajda', 'name': 'Ivča Procházková', 'id': '4022972474'}];;;;
1,27579E+18;1,27579E+18;2020-06-24 16:06:04 Střední Evropa (letní čas);24.06.2020;16:06:04;200;1,23446E+18;tradecentrum;TradeCentrumCZ;;💰#Fujifilm utratí 928 mil. USD na zdvojnásobení kapacity v továrně Fujifilm Diosynth Biotechnologies v Dánsku, která má vyrábět lék na COVID-19. 〽Akcie firmy Fujifilm (TYO: 4901) posílily o +0,66%⬆  #TradeCentrum #trading #USD #TYO #burza #lek #covid #koronavirus #trh  https://t.co/qaYi9AhmqB;cs;[];[];['https://pbs.twimg.com/media/EbSGV6RWsAAJhon.jpg'];0;0;0;['fujifilm', 'tradecentrum', 'trading', 'usd', 'tyo', 'burza', 'lek', 'covid', 'koronavirus', 'trh'];[];https://twitter.com/TradeCentrum/status/1275792312128409600;NEPRAVDA;;1;https://pbs.twimg.com/media/EbSGV6RWsAAJhon.jpg;;;;;;;[];;;;
1,27751E+18;1,27736E+18;2020-06-29 09:40:18 Střední Evropa (letní čas);29.06.2020;9:40:18;200;9,69114E+17;miia_brz;Míša B. 🇺🇦;;@ondratej @VojtechGibis Již jsem byla upozorněna, našla jsem na netu jenom to číslo 250 - 500 tis.. I tak je již teď zřejmé, že Covid-19 bude mít ročně obětí daleko víc než chřipka. Bohužel😟;cs;[];[];[];2;0;0;[];[];https://twitter.com/miia_brz/status/1277507168095424512;NEPRAVDA;;0;;;;;;;;[{'screen_name': 'ondratej', 'name': '🇺🇦 O T - Слава Україні! 🌻', 'id': '114134272'}, {'screen_name': 'VojtechGibis', 'name': 'Vojtěch Gibiš', 'id': '371051055'}];;;;
1,27748E+18;1,27748E+18;2020-06-29 07:39:00 Střední Evropa (letní čas);29.06.2020;7:39:00;200;1,27581E+18;adamekmiroslav;M;;300!!!😱😫😲 Masakr začíná...☝️☠ #COVID__19  https://t.co/493Wt6Xkfv;cs;[];['https://www.idnes.cz/zpravy/domaci/koronavirus-nakazeni-tri-sta-novych-nakazenych-nemocni-vyleceni-narust-pripadu.A200629_062011_domaci_vlc'];[];0;0;0;['covid__19'];[];https://twitter.com/AdamekMiroslav/status/1277476642299023360;NEPRAVDA;;0;;;;;;;;[];;;;
1,27747E+18;1,27747E+18;2020-06-29 07:01:03 Střední Evropa (letní čas);29.06.2020;7:01:03;200;7,23054E+17;seznamzpravy;Seznam Zprávy;;Je pondělí 29. června  💵Končí termín pro žádosti o kompenzační bonus v rámci prvního období  😷Ministr Vojtěch představí lokální opatření proti šíření covidu-19  🗳Duda zvítězil v prvním kole polských voleb, ve druhém se utká s Trzaskowským  🎬Poslední @StastnePondeli sezony;cs;[{'screen_name': 'stastnepondeli', 'name': 'šťastné pondělí jindřicha šídla', 'id': '1041376212684292101'}];[];[];0;0;11;[];[];https://twitter.com/SeznamZpravy/status/1277467091403186181;NEPRAVDA;;0;;;;;;;;[];;;;
1,27712E+18;1,27712E+18;2020-06-28 07:51:45 Střední Evropa (letní čas);28.06.2020;7:51:45;200;7,23054E+17;seznamzpravy;Seznam Zprávy;;Je neděle 28. června  🇵🇱Poláci půjdou k 1. kolu odložených prezidentských voleb  🇨🇳Zasedne vrcholný orgán čínského parlamentu, projednávat mohou i kontroverzní bezpečnostní zákon pro Hongkong  😷V sobotu přibylo 260 nakažených covid-19, nejvíc od začátku dubna;cs;[];[];[];2;0;17;[];[];https://twitter.com/SeznamZpravy/status/1277117461347868673;NEPRAVDA;;0;;;;;;;;[];;;;
1,27691E+18;1,27691E+18;2020-06-27 18:22:39 Střední Evropa (letní čas);27.06.2020;18:22:39;200;1915891352;zdenekbubak;Zdeněk Bubák;;K 17:30 v sobotu od rána 126 nově pozitivních s Covidem-19. Kolik to bude za celý den? Odhaduju 200. 😨;cs;[];[];[];5;1;4;[];[];https://twitter.com/ZdenekBubak/status/1276913844267421698;NEPRAVDA;https://twitter.com/CT24zive/status/1276906962718986240;0;;;;;;;;[];;;;
1,27606E+18;1,27606E+18;2020-06-25 09:38:15 Střední Evropa (letní čas);25.06.2020;9:38:15;200;8,02192E+17;dantoamarketing;DANTOA;;Google Ads poskytuje pomoc malým a středním firmám v podobě kreditu až 1 000 USD jako reakci na situaci způsobenou COVID-19. 💰 Výše kreditu je závislá na předešlé útratě a při splnění stanovených podmínek bude postupně připisován. 💪  https://t.co/hLREUbB4ry;cs;[];['https://tinyurl.com/yc6z4u3n'];[];0;0;1;[];[];https://twitter.com/dantoamarketing/status/1276057099865391105;NEPRAVDA;;0;;;;;;;;[];;;;
1,27587E+18;1,2754E+18;2020-06-24 20:55:36 Střední Evropa (letní čas);24.06.2020;20:55:36;200;1,07619E+18;blaster96058160;Blaster;;@dominikduka Tak ještě poděkovat agentu Burešovi za skoro zdaněné církevní restituce, Čínské lidové republice za předražené roušky, zavlečení Covid 19 do celého světa (Taiwanu neděkovat!!), prezidentovi za lobbing u komunistů v době, kdy převáželi ostatky kardinála Berana do Prahy.  😭 atd.;cs;[];[];[];0;0;0;[];[];https://twitter.com/Blaster96058160/status/1275865171819446272;NEPRAVDA;;0;;;;;;;;[{'screen_name': 'dominikduka', 'name': 'Kardinál Duka', 'id': '188244119'}];;;;
1,27585E+18;1,27585E+18;2020-06-24 19:47:36 Střední Evropa (letní čas);24.06.2020;19:47:36;200;2704101762;investor666666;Petr Kouba;;@kweenolog Ztraceno v překladu, naopak sebekriticky řekl - covid-19 byl už na odchodu, ale bohužel se zastavil o mou zeď. 😁🤣😆;cs;[];[];[];1;0;5;[];[];https://twitter.com/investor666666/status/1275848058941714432;NEPRAVDA;;0;;;;;;;;[{'screen_name': 'kweenolog', 'name': '特热邦的狼 WvW', 'id': '3299663681'}];;;;
1,27579E+18;1,27579E+18;2020-06-24 16:06:04 Střední Evropa (letní čas);24.06.2020;16:06:04;200;1,23446E+18;tradecentrum;TradeCentrumCZ;;💰#Fujifilm utratí 928 mil. USD na zdvojnásobení kapacity v továrně Fujifilm Diosynth Biotechnologies v Dánsku, která má vyrábět lék na COVID-19. 〽Akcie firmy Fujifilm (TYO: 4901) posílily o +0,66%⬆  #TradeCentrum #trading #USD #TYO #burza #lek #covid #koronavirus #trh  https://t.co/qaYi9AhmqB;cs;[];[];['https://pbs.twimg.com/media/EbSGV6RWsAAJhon.jpg'];0;0;0;['fujifilm', 'tradecentrum', 'trading', 'usd', 'tyo', 'burza', 'lek', 'covid', 'koronavirus', 'trh'];[];https://twitter.com/TradeCentrum/status/1275792312128409600;NEPRAVDA;;1;https://pbs.twimg.com/media/EbSGV6RWsAAJhon.jpg;;;;;;;[];;;;
1,27503E+18;1,27503E+18;2020-06-22 13:29:21 Střední Evropa (letní čas);22.06.2020;13:29:21;200;9,69114E+17;miia_brz;Míša B. 🇺🇦;;@PetrTnv Covid-19 se nemůže vracet. Když nikdy neodešel...🤷‍♀️Doteď jsme měli obrovský štěstí, snad se nás bude držet i nadále...😟;cs;[];[];[];0;0;4;[];[];https://twitter.com/miia_brz/status/1275028093435027461;NEPRAVDA;;0;;;;;;;;[{'screen_name': 'PetrTnv', 'name': 'Petan', 'id': '791687737082580992'}];;;;
1,27503E+18;1,27503E+18;2020-06-22 13:17:18 Střední Evropa (letní čas);22.06.2020;13:17:18;200;2776762801;fbeyeee;Roman M;;"Pacientka nemocnice ve Voroněžské oblasti natočila video, v jakých podmínkách se nachází pacienti v izolaci s COVID-19. Ale mě se líbil koment k videu ""Z videa je vidět, že po putinských úřednících už Voroněž nemá smysl bombardovat"". 😬  https://t.co/HMP2X7FiWT";cs;[];[];[];7;10;67;[];[];https://twitter.com/Fbeyeee/status/1275025064430391296;NEPRAVDA;;1;https://pbs.twimg.com/ext_tw_video_thumb/1275024954254405633/pu/img/U-elseEtiHYIcil5.jpg;;;;;;;[];;;;
1,27471E+18;1,27471E+18;2020-06-21 16:09:01 Střední Evropa (letní čas);21.06.2020;16:09:01;200;3248808448;detektivstika;Jiri Sticky;;V souvislosti s covid-19 zemřelo v Česku první dítě, kluk ve věkové kategorii 0 až 14 let, vyplývá ze zveřejněných statistik MZ ČR 💔;cs;[];[];[];6;3;14;[];[];https://twitter.com/detektivstika/status/1274705887509299200;NEPRAVDA;;0;;;;;;;;[];;;;
1,27417E+18;1,27417E+18;2020-06-20 04:57:41 Střední Evropa (letní čas);20.06.2020;4:57:41;200;3241685410;mikesverca;Veronika Mikešová;;Kde jsi? Kde jsi? - SUCHO Celou noc, kde jsi? - SUCHO Čekám tě, kde jsi? Kde jsi? -SUCHO Vzpomínáš? Kde jsi? - SUCHO  Dobré ráno,  furt  leje jako z konve!  Maroš§v prstík vymazal Covid-19 i sucho  z médií.😂  https://t.co/DmfUNGKbv1;cs;[];[];['https://pbs.twimg.com/media/Ea7G4N-WoAUOZsa.png'];2;0;21;[];[];https://twitter.com/MikesVerca/status/1274174556039786496;NEPRAVDA;;1;https://pbs.twimg.com/media/Ea7G4N-WoAUOZsa.png;;;;;;;[];;;;
1,27406E+18;1,27404E+18;2020-06-19 21:20:32 Střední Evropa (letní čas);19.06.2020;21:20:32;200;195412506;fuckys;ElMachoGrande;;@inglor #QAnons Škoda, že korespondenční lístky a COVID-19 vyřadili Bernieho Sanderse😒  https://t.co/x4AG6N2Suv;cs;[];[];['https://pbs.twimg.com/media/Ea5dzAQWsAAfGre.png'];0;0;1;['qanons'];[];https://twitter.com/fuckys/status/1274059509447692290;NEPRAVDA;;1;https://pbs.twimg.com/media/Ea5dzAQWsAAfGre.png;;;;;;;[{'screen_name': 'inglor', 'name': 'InDois ZerNiTTen', 'id': '1433182204029513733'}];;;;
1,27403E+18;1,2739E+18;2020-06-19 19:08:35 Střední Evropa (letní čas);19.06.2020;19:08:35;200;8,2502E+17;debritoag;André G. de Brito 🇺🇦🇨🇿🇪🇺🇬🇧🇺🇸🇮🇱🇨🇭🇦🇴;;@Sebela_CT 🤣🤣🤣 Prší...?! Ale je tu COVID-19, takže kámoš potřebuje finance, bez práce nejsou koláče! ...Dešť...?! To je ale přírodní jev, a ten  nelze zapsát do protokolu pracovních úkonů! Jsme Češi ne! 😂;cs;[];[];[];0;0;0;[];[];https://twitter.com/debritoAG/status/1274026302996176896;NEPRAVDA;;0;;;;;;;;[{'screen_name': 'Sebela_CT', 'name': 'Michal Šebela', 'id': '3972616696'}];;;;
1,27353E+18;1,27353E+18;2020-06-18 10:25:28 Střední Evropa (letní čas);18.06.2020;10:25:28;200;1544364842;lukaskovanda;Lukáš Kovanda;;Počet nakažených „pekingskou variantou“ nemoci covid-19 se přehoupl přes 150 a úřady od včerejška v postižených oblastech čínské metropole uzavřely školy. Nákaza už ochromila také letecký provoz v Pekingu, když včera bylo zrušeno údajně zhruba 70 procent plánovaných odletů. 😬;cs;[];[];[];1;3;13;[];[];https://twitter.com/LukasKovanda/status/1273532267525214208;NEPRAVDA;;0;;;;;;;;[];;;;
1,27325E+18;1,27321E+18;2020-06-17 15:40:50 Střední Evropa (letní čas);17.06.2020;15:40:50;200;1,18739E+18;libors3;LiborS;;@PetrNov95968147 @EuroZpravycz Zájem českých podnikatelů ….. byl o miliardy ze státního rozpočtu, protože😭 covid-19..... Tak ono to není s tou naší republikou tak špatné. Nechci být svině, ale v případě, že některý z těchto cestovatelů žádal, hned by to měl vrátit. Včetně Vystrčila, který neví co s korunou.;cs;[];[];[];0;0;1;[];[];https://twitter.com/LiborS3/status/1273249246561566722;NEPRAVDA;;0;;;;;;;;[{'screen_name': 'PetrNov95968147', 'name': 'Petr Novák', 'id': '920557826363330561'}, {'screen_name': 'EuroZpravycz', 'name': 'EuroZprávy.cz', 'id': '149954695'}];;;;
1,27287E+18;1,27287E+18;2020-06-16 14:52:34 Střední Evropa (letní čas);16.06.2020;14:52:34;200;2668648297;dodo50aladin;aladin;;Tady se nečeká na testování a ověřenou bezpečnost vakcíny covid 19..., tady se čeká, až se těch sraček vyrobí hektolitry... 👎.   https://t.co/B7geDHM2pu;cs;[];['https://www.prahavaccines.cz/novinky/'];[];0;0;0;[];[];https://twitter.com/dodo50aladin/status/1272874711421202437;NEPRAVDA;;0;;;;;;;;[];;;;
1,27287E+18;1,27287E+18;2020-06-16 14:28:16 Střední Evropa (letní čas);16.06.2020;14:28:16;200;3232972427;mkc_praha;MKC Praha;;Studenti Gymnázia Přípotoční připravili pro web MigraceOnline přehled zajímavých map 🌍, které zobrazují šíření Covid-19 😷 ve světě. Každou z map stručně představili. Více najdete tady 👉  https://t.co/W6WB7hk5s6  https://t.co/mcAPWIZIvW;cs;[];['https://1url.cz/czRpa'];['https://pbs.twimg.com/media/EaojJMkXYAA0wGI.jpg'];0;0;1;[];[];https://twitter.com/mkc_praha/status/1272868594687381504;NEPRAVDA;;1;https://pbs.twimg.com/media/EaojJMkXYAA0wGI.jpg;;;;;;;[];;;;
1,2714E+18;1,27069E+18;2020-06-12 13:10:18 Střední Evropa (letní čas);12.06.2020;13:10:18;200;7,51384E+17;gustavsantarius;FK Krnov ⚽️🇨🇿🏆;;Utkání zrušeno z důvodu karantény hráčů Dětmarovic na covid 19 😢;cs;[];[];[];0;0;1;[];[];https://twitter.com/GustavSantarius/status/1271399424552570882;NEPRAVDA;;0;;;;;;;;[];;;;
1,27574E+18;1,27574E+18;2020-06-24 12:53:50 Střední Evropa (letní čas);24.06.2020;12:53:50;200;382065771;enovationsro;Dotace pro podniky;;😷Zavřeli vám hotel, penzion či provozovnu? 💸Získejte až 10 mil. Kč na nájem za duben, květen a červen. ➡Pro ty, kterým byl na základě mimořádných opatření proti šíření koronaviru zakázán prodej zboží a služeb v provozovnách. ➡Příjem žádostí od 26. 6.  https://t.co/PLKyiBuBQX;cs;[];['https://www.enovation.cz/eu-dotace/operacni-program/programy-mpo/covid-najemne/'];[];0;0;0;[];[];https://twitter.com/enovationsro/status/1275743932685733895;NEPRAVDA;;0;;;;;;;;[];;;;
1,27544E+18;1,27544E+18;2020-06-23 16:28:05 Střední Evropa (letní čas);23.06.2020;16:28:05;200;324872115;nikaknapkova;Nikøla Knápková;;lol pamatuju, jak jeho žena asi tři měsíce zpátky na instagramu sdílela nějaké fake konspirační video o (ne)pravdivosti koronaviru.. tak co Jeleno už na něj věříš?🙈🙈;cs;[];[];[];0;0;3;[];[];https://twitter.com/nikaknapkova/status/1275435464019734528;NEPRAVDA;https://twitter.com/ozmo_sasa/status/1275398008167976960;0;;;;;;;;[];;;;
1,27533E+18;1,27533E+18;2020-06-23 09:41:40 Střední Evropa (letní čas);23.06.2020;9:41:40;200;7,0436E+17;mirek_62;Mirek_62;;@CT24zive Těch půl milionu „obětí” - bylo u všech prokázáno, že primární příčinou úmrtí byl koronavir?  V opačném případě to nejsou oběti koronaviru. Jenže to by se pak hůř prosazovaly restrikce a v rámci nich „přitahovaly šrouby”. Myslilm, že už toho strašení bylo dost 👎;cs;[];[];[];1;0;0;[];[];https://twitter.com/Mirek_62/status/1275333185572921344;NEPRAVDA;;0;;;;;;;;[{'screen_name': 'CT24zive', 'name': 'ČT24', 'id': '116411298'}];;;;
1,27529E+18;1,27529E+18;2020-06-23 07:01:21 Střední Evropa (letní čas);23.06.2020;7:01:21;200;7,15284E+17;zpravypozitivni;Pozitivní zprávy;;Co to je koroňák nebo prdom? Čeština se s koronavirem dočkala nových slovíček.😊  https://t.co/cxrh1tFBMj  https://t.co/0KNy3ewm8O;cs;[];['https://bit.ly/313P9fL'];['https://pbs.twimg.com/media/EbK__KjXYAA6fre.jpg'];0;0;3;[];[];https://twitter.com/ZpravyPozitivni/status/1275292841879703557;NEPRAVDA;;1;https://pbs.twimg.com/media/EbK__KjXYAA6fre.jpg;;;;;;;[];;;;
1,2752E+18;1,2752E+18;2020-06-23 00:59:41 Střední Evropa (letní čas);23.06.2020;0:59:41;200;1,22474E+18;damnnn_boy;𝒥🦖;;Jako really mi zablokoval instagram stories jenom proto, že jsem natočil storytime s černou obrazovkou a myslí si, že jsem šířil falešný informace o koroně? 😆😆;cs;[];[];[];2;0;10;[];[];https://twitter.com/damnnn_boy/status/1275201822056161282;NEPRAVDA;;0;;;;;;;;[];;;;
1,27518E+18;1,27518E+18;2020-06-22 23:29:32 Střední Evropa (letní čas);22.06.2020;23:29:32;200;1,02189E+18;amynamamina;Emilek 🦋;;Korona mi vzala radost z prázdnin 😡;cs;[];[];[];0;2;20;[];[];https://twitter.com/amynamamina/status/1275179134801641474;NEPRAVDA;;0;;;;;;;;[];;;;
1,27504E+18;1,27504E+18;2020-06-22 14:12:03 Střední Evropa (letní čas);22.06.2020;14:12:03;200;1,034E+18;perun64;MUDRc. samouk Perun;;Konference veverek k pandemii koronaviru: závěrem - to je problém lidí takže na to prdíme.. 🐱😌😂;cs;[];[];[];0;0;0;[];[];https://twitter.com/Perun64/status/1275038841968173056;NEPRAVDA;https://twitter.com/EssermikeMe/status/1274910667372445697;0;;;;;;;;[];;;;
1,27503E+18;1,27501E+18;2020-06-22 13:44:53 Střední Evropa (letní čas);22.06.2020;13:44:53;200;212241723;1oondaa1;Ondra Vacek 🇺🇦;;@raulik81 Pokaždé když jede sanitka, tak dcera říká hele jede korona.😂;cs;[];[];[];0;0;1;[];[];https://twitter.com/1Oondaa1/status/1275032005974073349;NEPRAVDA;;0;;;;;;;;[{'screen_name': 'raulik81', 'name': 'Jiri Benes', 'id': '251272328'}];;;;
