id;conversation_id;created_at;date;time;timezone;user_id;username;name;place;tweet;language;mentions;urls;photos;replies_count;retweets_count;likes_count;hashtags;cashtags;link;retweet;quote_url;video;thumbnail;near;geo;source;user_rt_id;user_rt;retweet_id;reply_to;retweet_date;translate;trans_src;trans_dest
1,26337E+18;1,26337E+18;2020-05-21 09:29:02 Střední Evropa (letní čas);21.05.2020;9:29:02;200;9,70397E+17;amspcr;Asociace malých a středních podniků a živnostníků;;😷 @ZdravkoOnline (Ministerstvo zdravotnictví České republiky) nařizuje mimořádné opatření pohybu a pobytu bez ochranných prostředků v souvislosti s prevencí nebezpečí vzniku a rozšíření onemocnění COVID-19. ℹ️ https://t.co/X7uSdwrheg  https://t.co/4XTIwr7mT1;cs;[{'screen_name': 'zdravkoonline', 'name': 'ministerstvo zdravotnictví', 'id': '3293937255'}];['http://amsp.cz/mimoradne-opatreni-o-pohybu-a-pobytu-osob-bez-ochrannych-prostredku-dychacich-cest/'];['https://pbs.twimg.com/media/EYhlS0uWoAEBO1z.jpg'];0;0;0;[];[];https://twitter.com/amspcr/status/1263371205949689857;NEPRAVDA;;1;https://pbs.twimg.com/media/EYhlS0uWoAEBO1z.jpg;;;;;;;[];;;;
1,26335E+18;1,26335E+18;2020-05-21 08:00:40 Střední Evropa (letní čas);21.05.2020;8:00:40;200;1,24852E+18;zapiskyzep;Zápisky z epidemie;;Prezident Spojených států amerických Donald Trump už týden a půl užívá lék hydroxychlororin proti malárii, aby zmírnil příznaky, pokud by se nakazil nemocí covid-19. Účinnost přípravku k léčbě covidu-19 se přitom dosud neprokázala.  Užívá také antibiotika a savo? 😂🦇;cs;[];[];[];0;0;2;[];[];https://twitter.com/zapiskyzep/status/1263348969054384129;NEPRAVDA;;0;;;;;;;;[];;;;
1,2632E+18;1,2632E+18;2020-05-20 22:00:03 Střední Evropa (letní čas);20.05.2020;22:00:03;200;8,74634E+17;happyjak2grapy;happy;;33 pet lahví...  Jsem teď v pokoji posbíral..  Karanténa be like. 😂 😂  #Covid_19 #Corona #karantena #belike;cs;[];[];[];0;0;1;['covid_19', 'corona', 'karantena', 'belike'];[];https://twitter.com/happyjak2grapy/status/1263197817834803200;NEPRAVDA;;0;;;;;;;;[];;;;
1,26298E+18;1,26298E+18;2020-05-20 07:25:31 Střední Evropa (letní čas);20.05.2020;7:25:31;200;4726367657;amritaja;milada krajíčková;;...nejsou všechny výsledky z Darkova 😷👎🌚Nárůst případů covidu-19 v Česku zmírnil, oproti pondělí klesl o polovinu  https://t.co/zyq1gEVNXA prostřednictvím @iDNEScz;cs;[{'screen_name': 'idnescz', 'name': 'idnes.cz', 'id': '52486297'}];['https://www.idnes.cz/zpravy/domaci/koronavirus-covid-19-nakaza-pocet-pripadu-zmirneni-ministerstvo-zdravotnictvi.A200520_060552_domaci_aug&utm_source=twitter&utm_medium=sharecm'];[];0;0;0;[];[];https://twitter.com/AmritaJa/status/1262977735053447169;NEPRAVDA;;0;;;;;;;;[];;;;
1,26282E+18;1,26282E+18;2020-05-19 20:46:53 Střední Evropa (letní čas);19.05.2020;20:46:53;200;554966207;zik4444zik;zik;;deje sa to aj v Česku. “mrtvých více”. @iDNEScz  😳😳😳 #Covid_19  #Weird  https://t.co/FBw6t3yebO;cs;[{'screen_name': 'idnescz', 'name': 'idnes.cz', 'id': '52486297'}];[];['https://pbs.twimg.com/media/EYZtYgLXkAAtdnB.jpg'];0;0;0;['covid_19', 'weird'];[];https://twitter.com/zik4444zik/status/1262817017951850501;NEPRAVDA;https://twitter.com/zik4444zik/status/1260611490459066370;1;https://pbs.twimg.com/media/EYZtYgLXkAAtdnB.jpg;;;;;;;[];;;;
1,26209E+18;1,26209E+18;2020-05-17 20:42:37 Střední Evropa (letní čas);17.05.2020;20:42:37;200;70725936;irozhlascz;iROZHLAS.cz;;Pokusy na křečcích odhalily, že hromadné používání roušek snižuje přenos koronaviru, jenž způsobuje nemoc covid-19😷 Oznámil to v neděli tým vědců z Hongkongu, které citovala agentura AFP.   https://t.co/LYF2ASiy1b;cs;[];['https://www.irozhlas.cz/zpravy-svet/krecci-pokus-rousky-sireni-nakazy-covid-19-vedci_2005172038_aur'];[];8;4;25;[];[];https://twitter.com/iROZHLAScz/status/1262091167442833414;NEPRAVDA;;0;;;;;;;;[];;;;
1,26193E+18;1,26193E+18;2020-05-17 10:21:53 Střední Evropa (letní čas);17.05.2020;10:21:53;200;1,13769E+18;aloisdvorak;Alois DVOŘÁK;;@paulczynski @ODScz @Jan_Skopecek Je. Takhle kvalitně by zřejmě modrobrýlatý premiér zvládal COVID-19. Možná COVID-20.😂;cs;[];[];[];1;0;1;[];[];https://twitter.com/AloisDvorak/status/1261934955950678016;NEPRAVDA;;0;;;;;;;;[{'screen_name': 'paulczynski', 'name': 'Petr Paulczyňski 👫 🇨🇿', 'id': '555176287'}, {'screen_name': 'ODScz', 'name': 'ODS', 'id': '56410958'}, {'screen_name': 'Jan_Skopecek', 'name': 'Jan Skopeček', 'id': '1869336583'}];;;;
1,2618E+18;1,2618E+18;2020-05-17 01:17:35 Střední Evropa (letní čas);17.05.2020;1:17:35;200;1,24693E+18;bonesalkos;Bones;;Kvota 1.01 na COVID-19😷;cs;[];[];[];0;0;1;[];[];https://twitter.com/Bonesalkos/status/1261797977607331840;NEPRAVDA;https://twitter.com/7tazeboranija3/status/1261796146726526978;0;;;;;;;;[];;;;
1,26178E+18;1,26178E+18;2020-05-17 00:04:05 Střední Evropa (letní čas);17.05.2020;0:04:05;200;1,12584E+18;kazvampires;kazvampires ❁;;Lіvе-Aсtіоn Urауаѕu Tеkkіn Kаzоku Sеrіеѕ Dеlау Karena COVID-19   #浦安鉄筋家族 💥 #佐藤二朗 #水野美紀 #岸井ゆきの #本多力 #斎藤汰鷹 #坂田利夫 #瑠東東郎 #上田誠 💩 #浦鉄 #浦安鉄筋家族  https://t.co/X7bTsVOqnd;cs;[];['https://kazvampires.blogspot.com/2020/05/urayasu-tekkin-kazoku-liveaction.html'];[];0;0;0;['浦安鉄筋家族', '佐藤二朗', '水野美紀', '岸井ゆきの', '本多力', '斎藤汰鷹', '坂田利夫', '瑠東東郎', '上田誠', '浦鉄', '浦安鉄筋家族'];[];https://twitter.com/kazvampires/status/1261779479212355584;NEPRAVDA;;0;;;;;;;;[];;;;
1,26173E+18;1,26173E+18;2020-05-16 20:34:02 Střední Evropa (letní čas);16.05.2020;20:34:02;200;50634025;kovi20;Martin Kovařík;;Druhý test na COVID-19 nás čeká ve čtvrtek...už teď se nemůžu dočkat 🙈🙈🙈 #skláři #fortunaliga  https://t.co/W4LNnQnRIV;cs;[];[];['https://pbs.twimg.com/tweet_video_thumb/EYKNqylXQAQRNV2.jpg'];3;0;6;['skláři', 'fortunaliga'];[];https://twitter.com/Kovi20/status/1261726620034924549;NEPRAVDA;;1;https://pbs.twimg.com/tweet_video_thumb/EYKNqylXQAQRNV2.jpg;;;;;;;[];;;;
1,26588E+18;1,26588E+18;2020-05-28 07:45:14 Střední Evropa (letní čas);28.05.2020;7:45:14;200;3003612837;blanikz;Radovan Vávra;;ZÁSAH COVIDEM  Dnešní díl Korony vs. Koruny přichází s menším zpožděním v důsledku nepřízně počasí. 😊 Dnes se budeme zabývat dalším sektorem ekonomiky, který byl silně ovlivněn Covidem.…  https://t.co/UO43VGGkjN;cs;[];['https://www.instagram.com/p/CAuF14SnIqR/?igshid=1e1e6m2t3t11j'];[];0;0;10;[];[];https://twitter.com/BlanikZ/status/1265881799709937664;NEPRAVDA;;0;;;;;;;;[];;;;
1,26574E+18;1,26573E+18;2020-05-27 22:16:11 Střední Evropa (letní čas);27.05.2020;22:16:11;200;7,60513E+17;aleskolisek;Aleš Kolísek-stojíme při vás 🇺🇦;;@TondaKoutsky @LZavit Antoníne! V sobotu hrajeme první mač po koroně 😊⚽️;cs;[];[];[];0;0;1;[];[];https://twitter.com/AlesKolisek/status/1265738592032223232;NEPRAVDA;;0;;;;;;;;[{'screen_name': 'TondaKoutsky', 'name': 'Tonda', 'id': '891232838737154048'}, {'screen_name': 'LZavit', 'name': 'Levy_zavit', 'id': '1030557222408015874'}];;;;
1,26569E+18;1,26569E+18;2020-05-27 19:01:33 Střední Evropa (letní čas);27.05.2020;19:01:33;200;1,24852E+18;zapiskyzep;Zápisky z epidemie;;Češi budou letos pracovat na stát nejdéle od roku 2000. Může za to z velké části koronavirus 💰 A nemohou za to také vysoké daně a odvody, které se v ČR platí? Jasně, budeme letos delší dobu pracovat pro stát, ale nebylo by dobré v této době daně snížit a tím podpořit ekonomiku?;cs;[];[];[];0;0;9;[];[];https://twitter.com/zapiskyzep/status/1265689613227696131;NEPRAVDA;;0;;;;;;;;[];;;;
1,26565E+18;1,26565E+18;2020-05-27 16:41:07 Střední Evropa (letní čas);27.05.2020;16:41:07;200;1933649256;nestleczsk;NestléČeskoSlovensko;;🎉 Další semestr ve spolupráci s Vysokou školou ekonomickou v Praze je za námi! Kvůli koroně probíhal ve virtuálním online prostředí. Blahopřejeme všem studentům 👩‍💻👨‍💻, kteří předvedli skvělé prodejní prezentace i komunikační plány. Jste jedničky!  #NestleNeedsYouth #AllForYouth  https://t.co/LsoCwOTwYs;cs;[];[];['https://pbs.twimg.com/media/EZCBvLqWkAAQFgn.jpg'];0;0;0;['nestleneedsyouth', 'allforyouth'];[];https://twitter.com/NestleCZSK/status/1265654271858610176;NEPRAVDA;;1;https://pbs.twimg.com/media/EZCBvLqWkAAQFgn.jpg;;;;;;;[];;;;
1,26564E+18;1,26564E+18;2020-05-27 15:26:42 Střední Evropa (letní čas);27.05.2020;15:26:42;200;4726367657;amritaja;milada krajíčková;;... paráda 🌎🍀👍👍👍🌈🌹😷Čeští vědci vyvinuli nový typ oxygenerátoru, mohl by pomoct pacientům s koronavirem  https://t.co/6c0yFoZ6SU;cs;[];['https://ct24.ceskatelevize.cz/veda/3106073-cesti-vedci-vyvinuli-novy-typ-oxygeneratoru-mohl-pomoct-pacientum-s-koronavirem'];[];0;0;1;[];[];https://twitter.com/AmritaJa/status/1265635544220008449;NEPRAVDA;;0;;;;;;;;[];;;;
1,2656E+18;1,2656E+18;2020-05-27 13:04:55 Střední Evropa (letní čas);27.05.2020;13:04:55;200;1,0152E+18;rouzivdimenzi;Rouzí.;;Nějaká paní v autobuse řekla že ji koronavirus přidal tak 10 kilo  Soucítím s tebou segra 😂;cs;[];[];[];0;0;2;[];[];https://twitter.com/rouziVdimenzi/status/1265599864018255883;NEPRAVDA;;0;;;;;;;;[];;;;
1,26556E+18;1,26556E+18;2020-05-27 10:08:40 Střední Evropa (letní čas);27.05.2020;10:08:40;200;67561926;ceskarepre_cz;Česká fotbalová reprezentace;;Nejlepší střelec v historii #ceskarepre se nedávno dostal do Síně slávy, ale oficiální uvedení si kvůli koronaviru ještě neužil 😷  Celý rozhovor s Janem Kollerem 📺  https://t.co/Ls6ZjM4oOv  https://t.co/Y0CI8DbV8y;cs;[];['http://www.gol.cz/clanky/jan-koller-dortmundsky-vyslanec'];['https://pbs.twimg.com/media/EZAnlukXQAAfduw.jpg'];0;1;9;['ceskarepre'];[];https://twitter.com/ceskarepre_cz/status/1265555505638002696;NEPRAVDA;;1;https://pbs.twimg.com/media/EZAnlukXQAAfduw.jpg;;;;;;;[];;;;
1,26555E+18;1,26135E+18;2020-05-27 09:54:39 Střední Evropa (letní čas);27.05.2020;9:54:39;200;15352519;byczech;ByCzech;;@jirkakus @cryshot78 To jste si dovolili moc, fakturovat během korona krize?! Plán byl, že půjdete na hranicí krachu a vy si fakturuje? Že se nestydíte! 😂;cs;[];[];[];0;0;1;[];[];https://twitter.com/ByCzech/status/1265551978660270088;NEPRAVDA;;0;;;;;;;;[{'screen_name': 'jirkakus', 'name': '🕸Jiří Kůs', 'id': '468617661'}];;;;
1,26553E+18;1,26553E+18;2020-05-27 08:11:29 Střední Evropa (letní čas);27.05.2020;8:11:29;200;1,12907E+18;fuxit4;Fuxová Kat;;Ach jo 😖 trochu jiná oběť koronaviru. 👎🏻  https://t.co/gN0ZujUoEi;cs;[];['https://ct24.ceskatelevize.cz/domaci/3105866-zachranarka-kterou-kvuli-dopisu-hejtmance-stiha-policie-od-zachranne-sluzby-odchazi'];[];5;4;30;[];[];https://twitter.com/fuxit4/status/1265526018347012096;NEPRAVDA;;0;;;;;;;;[];;;;
1,2655E+18;1,2655E+18;2020-05-27 06:35:45 Střední Evropa (letní čas);27.05.2020;6:35:45;200;3007913817;me2drast;MeRaS;;Proti koronaviru stejně jako proti chřipce   očkování neberu. Nikdy! Až si pro mě takhle přijdou, budu připraven...! 🗡💪😊;cs;[];[];[];0;0;0;[];[];https://twitter.com/me2drast/status/1265501923295313921;NEPRAVDA;https://twitter.com/RealitaDne/status/1265493474402611204;0;;;;;;;;[];;;;
1,26524E+18;1,26523E+18;2020-05-26 12:55:51 Střední Evropa (letní čas);26.05.2020;12:55:51;200;8,77212E+17;mumzelka;Mumželka 🌈;;@marektomas98 Ok. Já bych to s ním doma taky zvládla, ale jestli on se mnou... 🤔😂 Dělá mu dobře, že má něco jen svého, vztahy, činnosti a zodpovědnost, kam mu nikdo z nás nevidí a nezasahuje. A řekli jsme si, že prostě zkusíme žít co nejvíc stejně, jako před koronou. Abychom se nezcvokli.;cs;[];[];[];1;0;5;[];[];https://twitter.com/mumzelka/status/1265235191490138112;NEPRAVDA;;0;;;;;;;;[{'screen_name': 'marektomas98', 'name': 'Tomáš Marek', 'id': '1121414971701768200'}];;;;
1,26523E+18;1,26523E+18;2020-05-26 12:52:50 Střední Evropa (letní čas);26.05.2020;12:52:50;200;8,20693E+17;midlinka1967;Nemilosrdná čarodějnice Saxana 🇨🇿🇷🇺🔥🕷🖤;;A toto celé je o koronaviru😡😤proč asi? Něco mě napadlo.Tady se totiž hraje na úplně jinou strunu. Vrací se nám z Anglie nepřizpůsobivé etnikum...za hranicemi jsou hordy migrantů též silně nepřizpůsobivých😡👿. Takže o čem to je?  https://t.co/8exTamHv6w;cs;[];[];['https://pbs.twimg.com/media/EY8Dtw5XQAE69VU.jpg'];0;1;6;[];[];https://twitter.com/Midlinka1967/status/1265234434548252672;NEPRAVDA;;1;https://pbs.twimg.com/media/EY8Dtw5XQAE69VU.jpg;;;;;;;[];;;;
1,26522E+18;1,26522E+18;2020-05-26 12:14:27 Střední Evropa (letní čas);26.05.2020;12:14:27;200;2454383298;onlajny_com;Onlajny_com;;Špatné zprávy z Ruska. Bývalý reprezentant Pavel Pogrebňjak se nakazil koronavirem a jeho stav je vážný. Má navíc oboustranný zápal plic a vysoké horečky. Hráč Uralu Jekatěrinburg se pravděpodobně nakazil v letadle cestou do klubu a navíc se poté nakazila i celá jeho rodina. 😢🙏;cs;[];[];[];0;0;0;[];[];https://twitter.com/Onlajny_com/status/1265224774860537857;NEPRAVDA;;0;;;;;;;;[];;;;
1,2652E+18;1,2652E+18;2020-05-26 10:25:13 Střední Evropa (letní čas);26.05.2020;10:25:13;200;407040558;udalostibrno;Události Brno;;😷Počet potvrzených případů nákazy novým typem koronaviru v Česku překročil 9000. V pondělí přibylo 47 nakažených, nejméně za poslední 4 dny.  Zemřelých s nemocí covid-19 je 317, téměř 6200 lidí se už vyléčilo a aktuálně se s ní potýká asi 2500 nakažených. #covid19cz  https://t.co/3iBwp05c0g;cs;[];[];['https://pbs.twimg.com/media/EY7iDQxXYAEAHJ4.jpg'];1;0;2;['covid19cz'];[];https://twitter.com/UdalostiBrno/status/1265197285849341952;NEPRAVDA;;1;https://pbs.twimg.com/media/EY7iDQxXYAEAHJ4.jpg;;;;;;;[];;;;
1,26519E+18;1,26519E+18;2020-05-26 09:44:42 Střední Evropa (letní čas);26.05.2020;9:44:42;200;1,2272E+18;__natalia__k__;𝕋𝔸𝕃𝕃𝕐;;Korona nás obrala o maturitní ples, poslední zvonění a poslední společnou fotku, takže ročník kterej měl být tím nejlepším ever, stál pěkně za 💩... Hlavně, že ta maturita je 🎓👏🏼 #covid2020;cs;[];[];[];0;0;1;['covid2020'];[];https://twitter.com/__Natalia__K__/status/1265187086841380866;NEPRAVDA;;0;;;;;;;;[];;;;
1,26507E+18;1,26507E+18;2020-05-26 01:44:20 Střední Evropa (letní čas);26.05.2020;1:44:20;200;2971608449;masokost;Masokost;;"""Záchranářka upozornila, že nejsou roušky. Úřad Jermanové se obrátil na policii.""  Výborně, hejtmanka Jermanová si myslí, že záchranáři nemají právo se ozvat, když jim nezabezpečí ochranné prostředky.😡  #koronavirus #COVID   https://t.co/InN4BjchHv prostřednictvím  L@SeznamZpravy";cs;[];['https://www.seznamzpravy.cz/clanek/zachranarka-upozornila-ze-nejsou-rousky-urad-jermanove-se-obratil-na-policii-107477#utm_source=twitter&utm_medium=sharebt&utm_campaign=top'];[];0;0;0;['koronavirus', 'covid'];[];https://twitter.com/masokost/status/1265066200016523269;NEPRAVDA;;0;;;;;;;;[];;;;
1,26505E+18;1,26503E+18;2020-05-26 00:25:49 Střední Evropa (letní čas);26.05.2020;0:25:49;200;486505186;nikyzutulku;Nikol Burešová 🐾🛸🇨🇿;;@AlexandrMitrofa Když ještě nebyla korona, nosila jsem roušku, když jsem měla kašel. V metru se okolo mě rychle udělalo volno a hezky jsem si sedla. Doufám, že se to zas vrátí, teď jsou vagony nacpane a nikdo mi neuhyba 😢;cs;[];[];[];0;0;9;[];[];https://twitter.com/nikyzutulku/status/1265046442080702473;NEPRAVDA;;0;;;;;;;;[{'screen_name': 'AlexandrMitrofa', 'name': 'Alexandr Mitrofanov', 'id': '452235950'}];;;;
1,26503E+18;1,26503E+18;2020-05-25 23:32:24 Střední Evropa (letní čas);25.05.2020;23:32:24;200;1,23197E+18;malaalesikovna;prcek;;Teď jsem si tak uvědomila, že když bych od každého člověka, kterému jsem za dobu “korona prázdnin” poslala úkoly, vybírala nějaký money...tak bych byla teď už hrozně bohatá 😂🤣;cs;[];[];[];0;1;3;[];[];https://twitter.com/malaalesikovna/status/1265032996861759494;NEPRAVDA;;0;;;;;;;;[];;;;
1,26503E+18;1,26502E+18;2020-05-25 23:03:27 Střední Evropa (letní čas);25.05.2020;23:03:27;200;1,19031E+18;vojcl27;thunderbolt27;;@Otyz_8 V září by mohla prijit druha vlna korony😂;cs;[];[];[];0;0;2;[];[];https://twitter.com/vojcl27/status/1265025712861458435;NEPRAVDA;;0;;;;;;;;[];;;;
1,26502E+18;1,26502E+18;2020-05-25 22:34:26 Střední Evropa (letní čas);25.05.2020;22:34:26;200;3899734343;dozor1984;Hanuš R.;;👱A to ty otázky v testech na koronavirus jsou pro ty horníky tak těžké, že těmi testy tolik havířů neprojde? 😱 Jsou prý ještě těžší než otázky u maturity... 👱 Tak to nevím, maturitu jsem naštěstí zatím ještě nikdy nechytla.;cs;[];[];[];0;1;4;[];[];https://twitter.com/dozor1984/status/1265018408501944322;NEPRAVDA;;0;;;;;;;;[];;;;
1,265E+18;1,265E+18;2020-05-25 21:15:18 Střední Evropa (letní čas);25.05.2020;21:15:18;200;856060734;venuset;VenuseT;;Poslední epizoda @NBCBlacklist je kvůli koronaviru z poloviny animovaná 😲 Vím, jak to dopadlo, ale nelíbilo se mi to 😒 Raději bych si počkala na normální film.  https://t.co/A9R0TfPHbQ;cs;[{'screen_name': 'nbcblacklist', 'name': 'the blacklist', 'id': '1344919338'}];['https://twitter.com/NBCBlacklist/status/1261404247159009281?s=19'];[];0;0;1;[];[];https://twitter.com/VenuseT/status/1264998496031121410;NEPRAVDA;https://twitter.com/NBCBlacklist/status/1261404247159009281?s=19;0;;;;;;;;[];;;;
1,26499E+18;1,26498E+18;2020-05-25 20:38:52 Střední Evropa (letní čas);25.05.2020;20:38:52;200;1,05467E+18;petr_prokopec;Petr Prokopec;;@ZdenekVoda Evropa bojuje s koronavirem ale nedochází jí že umírá na rakovinu.. 😷;cs;[];[];[];0;1;8;[];[];https://twitter.com/petr_prokopec/status/1264989324694761473;NEPRAVDA;;0;;;;;;;;[];;;;
1,26498E+18;1,26498E+18;2020-05-25 20:13:54 Střední Evropa (letní čas);25.05.2020;20:13:54;200;9,67534E+17;linduskaa_n;Linda Nováková;;Já se prostě nemůžu bavit o koronaviru s někým, kdo na to nemá stejný názor. Vede to jenom k hádce 😒👊;cs;[];[];[];0;0;6;[];[];https://twitter.com/linduskaa_n/status/1264983045674762245;NEPRAVDA;;0;;;;;;;;[];;;;
1,26495E+18;1,26495E+18;2020-05-25 18:05:00 Střední Evropa (letní čas);25.05.2020;18:05:00;200;407040558;udalostibrno;Události Brno;;Roušky 😷 Zakryly obličeje a zaměstnaly tisíce dobrovolníků. Martina Ruská není jen jednou z mnoha. Až 70 roušek za den šila pro ostatní v době koronaviru i přesto, že má po nehodě jen jednu ruku. Někdy se kvůli dobrovolnické práci ani nestíhala najíst.  Děkujeme!!! #covid19cz  https://t.co/OqQSRAxVdb;cs;[];[];[];0;1;4;['covid19cz'];[];https://twitter.com/UdalostiBrno/status/1264950604054630402;NEPRAVDA;;1;https://pbs.twimg.com/ext_tw_video_thumb/1264916571207741441/pu/img/Q1q-otO3LP_kINfb.jpg;;;;;;;[];;;;
1,2649E+18;1,2649E+18;2020-05-25 14:41:25 Střední Evropa (letní čas);25.05.2020;14:41:25;200;9,39865E+17;marekkindernay;Marek Kindernay;;Tak bohužel další soutěž koronavirus neustála.😒Basketbalové přenosy se na @O2TVSportCZ vrátí v říjnu.;cs;[{'screen_name': 'o2tvsportcz', 'name': 'o2 tv sport', 'id': '3380313765'}];[];[];0;0;0;[];[];https://twitter.com/MarekKindernay/status/1264899371818266625;NEPRAVDA;https://twitter.com/EuroLeague/status/1264877929265352704;0;;;;;;;;[];;;;
1,26487E+18;1,26487E+18;2020-05-25 12:40:07 Střední Evropa (letní čas);25.05.2020;12:40:07;200;1,13112E+18;mcbechovice;MČ Praha - Běchovice;;😷❌ Od rána nemusíme venku nosit roušku. Rozhodně je ale ještě neodkládejte. Povinné zůstávají v obchodech, na úřadech nebo v MHD. Výjimku mají děti ve školách nebo lidé v kancelářích. ZDROJ: ČT24 #mcprahabechovice #koronavirus  https://t.co/X3EhaWRqCg;cs;[];[];['https://pbs.twimg.com/media/EY23gsBXYAAcw6b.jpg'];0;1;0;['mcprahabechovice', 'koronavirus'];[];https://twitter.com/mcbechovice/status/1264868847301136390;NEPRAVDA;;1;https://pbs.twimg.com/media/EY23gsBXYAAcw6b.jpg;;;;;;;[];;;;
1,26484E+18;1,26484E+18;2020-05-25 10:45:16 Střední Evropa (letní čas);25.05.2020;10:45:16;200;3945392054;terezka_90;Tereza Přibylová;;@Ravenhir No myslela jsem si, že se zde hovoří o koronaviru..... 😷;cs;[];[];[];0;0;0;[];[];https://twitter.com/Terezka_90/status/1264839941911187458;NEPRAVDA;;0;;;;;;;;[{'screen_name': 'Ravenhir', 'name': 'David Slížek', 'id': '34956852'}];;;;
1,26479E+18;1,26479E+18;2020-05-25 07:32:00 Střední Evropa (letní čas);25.05.2020;7:32:00;200;407040558;udalostibrno;Události Brno;;Co je ode dneška povoleno? Podívejte se v našem přehledu. Nastala další vlna uvolňování podnikatelských a dalších činností. 😷 #covid19cz #koronavirus  https://t.co/nFJAGiipRu;cs;[];[];['https://pbs.twimg.com/media/EYyGBaAXkAI6Xv8.jpg'];2;10;42;['covid19cz', 'koronavirus'];[];https://twitter.com/UdalostiBrno/status/1264791304224911360;NEPRAVDA;;1;https://pbs.twimg.com/media/EYyGBaAXkAI6Xv8.jpg;;;;;;;[];;;;
1,26479E+18;1,26479E+18;2020-05-25 07:30:00 Střední Evropa (letní čas);25.05.2020;7:30:00;200;120595601;tpetricek;Tomáš Petříček;;Dnes slavíme tradiční #DenAfriky. 🎉 #Koronavirus sice narušil některé naše plány, ale nedovolíme, aby narušil dlouhodobé vztahy mezi Českem a zeměmi Afriky. Toto náročné období překonáme jedině společně. Jsme s Afrikou, #Afrika je s námi! #AfricaDay 🌍  https://t.co/3VMc5vxUAN;cs;[];[];[];27;9;174;['denafriky', 'koronavirus', 'afrika', 'africaday'];[];https://twitter.com/TPetricek/status/1264790800573046784;NEPRAVDA;;1;https://pbs.twimg.com/ext_tw_video_thumb/1264640959675092993/pu/img/r_isrxeOd0VFm6ID.jpg;;;;;;;[];;;;
1,26463E+18;1,26463E+18;2020-05-24 21:05:05 Střední Evropa (letní čas);24.05.2020;21:05:05;200;2400562754;sssirda;Michal Sirový ⚫️ ⬛️;;Babiš odmítá být solidární se státy EU, které byly výrazněji postiženi koronavirem. 👇  Fajn, beru. ✅  Jak pak chce ale přijít za Německem, Itálií nebo Francií a chtít po nich desítky a stovky miliard na dotace „protože my jsme přece ti chudí“ ? 🙈  #KZblití;cs;[];[];[];1;1;31;['kzblití'];[];https://twitter.com/sssirda/status/1264633535287132162;NEPRAVDA;https://twitter.com/AnetaZachova/status/1264612966911049728;0;;;;;;;;[];;;;
1,26453E+18;1,26451E+18;2020-05-24 14:03:59 Střední Evropa (letní čas);24.05.2020;14:03:59;200;3150269402;7ambra7;Radek Barcal 🇨🇿🇪🇺;;@vitulrych @Pater_JanSpacek @SeznamZpravy Zatím se jim henten koronavirus podařilo jen vyfotit 😂  https://t.co/UZBHGZfKes;cs;[];[];['https://pbs.twimg.com/media/EYyBHL5XgAACz24.jpg'];0;0;10;[];[];https://twitter.com/7ambra7/status/1264527563034165248;NEPRAVDA;;1;https://pbs.twimg.com/media/EYyBHL5XgAACz24.jpg;;;;;;;[{'screen_name': 'vitulrych', 'name': 'Vít Ulrych', 'id': '248274121'}, {'screen_name': 'Pater_JanSpacek', 'name': 'P. Jan Špaček✌️ 🇨🇿 🇺🇦 🇪🇺', 'id': '2382345732'}, {'screen_name': 'SeznamZpravy', 'name': 'Seznam Zprávy', 'id': '723053842267398144'}];;;;
1,26449E+18;1,26449E+18;2020-05-24 11:23:05 Střední Evropa (letní čas);24.05.2020;11:23:05;200;2704101762;investor666666;Petr Kouba;;@davidrajmont Korona prohlubuje závislosti - předpokládám, že jsou na PéCé, abych použil teď moderní termín, ímrvére 😂;cs;[];[];[];1;0;2;[];[];https://twitter.com/investor666666/status/1264487072053723137;NEPRAVDA;;0;;;;;;;;[{'screen_name': 'davidrajmont', 'name': 'David Rajmont', 'id': '841772434156077057'}];;;;
1,26443E+18;1,26443E+18;2020-05-24 07:50:23 Střední Evropa (letní čas);24.05.2020;7:50:23;200;70725936;irozhlascz;iROZHLAS.cz;;😷Denní nárůst případů nemoci covid-19 způsobované novým typem koronaviru v Česku opět vzrostl, v sobotu přibylo 77 nakažených, o den dříve to bylo 59.⤵️  https://t.co/otDJg8BLIi;cs;[];['http://irozhl.as/a3s'];[];1;2;5;[];[];https://twitter.com/iROZHLAScz/status/1264433545260544000;NEPRAVDA;;0;;;;;;;;[];;;;
1,26392E+18;1,26392E+18;2020-05-22 22:03:16 Střední Evropa (letní čas);22.05.2020;22:03:16;200;9,40705E+17;don_vito007;DonVito007;;“mohou CK odložit vrácení peněz za zrušené zájezdy kvůli koronaviru.Místo nich budou klientům vydávat poukazy. Na odložení platby byměla do 31.8. 2021 platit ochranná doba..podle EK ale takový postup porušuje práva občanů”-co myslite,budouse lidi branit🙊?  https://t.co/Kk7ftpI5Rz;cs;[];['https://www.novinky.cz/clanek/exim-tours-a-ck-fischer-zrusily-vsechny-prazdninove-zajezdy-40325111?section=ekonomika'];[];0;0;2;[];[];https://twitter.com/Don_Vito007/status/1263923404631093248;NEPRAVDA;;0;;;;;;;;[];;;;
1,26391E+18;1,26389E+18;2020-05-22 21:01:12 Střední Evropa (letní čas);22.05.2020;21:01:12;200;1,18295E+18;iljon11;ILJON;;@AndrejBabis To vypadá na přímý zásah koronavirem.😱;cs;[];[];[];0;0;4;[];[];https://twitter.com/ILJON11/status/1263907782694223872;NEPRAVDA;;0;;;;;;;;[{'screen_name': 'AndrejBabis', 'name': 'Andrej Babiš', 'id': '713035525'}];;;;
1,26387E+18;1,26387E+18;2020-05-22 18:27:58 Střední Evropa (letní čas);22.05.2020;18:27:58;200;1,26356E+18;nwmjzs;Hmmmmm;;Nwm proc, ale prijde mi ze za dobu koronaviru jsem tak zlenivela, ze se ani k tem ukolum nedohrabu😂;cs;[];[];[];0;2;6;[];[];https://twitter.com/nwmjzs/status/1263869220686893057;NEPRAVDA;;0;;;;;;;;[];;;;
