id;conversation_id;created_at;date;time;timezone;user_id;username;name;place;tweet;language;mentions;urls;photos;replies_count;retweets_count;likes_count;hashtags;cashtags;link;retweet;quote_url;video;thumbnail;near;geo;source;user_rt_id;user_rt;retweet_id;reply_to;retweet_date;translate;trans_src;trans_dest
1,32883E+18;1,32883E+18;2020-11-17 23:44:54 Střední Evropa (běžný čas);17.11.2020;23:44:54;200;13311422;atpok;Martin Kopta;;Ještě znovu ke  https://t.co/UNCTdXud0K: Už přes 24 hodin je venku vládní usnesení č. 1191, které začne platit za pár minut. Na oficiálním vládním informačním webu o COVID‑19 se ale pořád píše, že děti do škol nesmí. Taková redakce je pro ostudu, pane @vdzurilla. 👎  https://t.co/UjxqvZ0T3A;cs;[{'screen_name': 'vdzurilla', 'name': 'vladimir dzurilla', 'id': '209482724'}];['http://covid.gov.cz'];['https://pbs.twimg.com/media/EnD1NdnXIAQs5sF.jpg'];5;0;12;[];[];https://twitter.com/atpok/status/1328831506429730817;NEPRAVDA;;1;https://pbs.twimg.com/media/EnD1NdnXIAQs5sF.jpg;;;;;;;[];;;;
1,32878E+18;1,32878E+18;2020-11-17 20:26:07 Střední Evropa (běžný čas);17.11.2020;20:26:07;200;2975472045;karelpatak1;Karel Paták;;Covid 19. Absence solidarity s rizik skupinami spoluobčanů a s těmi, kteří se s nákazou perou v rámci práce, je selhání části společnosti. O lidech, kteří dnes běhali po Pze a požadovali svobodu být sobci,v domnění, že jsou disidenty jako Pánek a Mejstřík v 89, ani nemluvím 🇨🇿💔;cs;[];[];[];6;9;82;[];[];https://twitter.com/KarelPatak1/status/1328781483012722689;NEPRAVDA;https://twitter.com/RadekNohl/status/1328774848689139717;0;;;;;;;;[];;;;
1,33538E+18;1,33538E+18;2020-12-06 01:43:10 Střední Evropa (běžný čas);06.12.2020;1:43:10;200;1,17406E+18;mannedtweets;Crewed Spaceflights Tweets;;Koronavirus na Ukrajině 🇺🇦😷  @SeznamZpravy: Ukrajinský lékař popsal zmar: 9 z 10 pacientů na ventilátorech umírá  https://t.co/lujeE2LhK8;cs;[{'screen_name': 'seznamzpravy', 'name': 'seznam zprávy', 'id': '723053842267398144'}];['https://www.seznamzpravy.cz/clanek/ukrajinsky-lekar-popsal-zmar-9-z-10-pacientu-na-ventilatorech-umira-132250#utm_source=twitter&utm_medium=sharebt&utm_campaign=top'];[];0;0;0;[];[];https://twitter.com/MannedTweets/status/1335384253098561536;NEPRAVDA;;0;;;;;;;;[];;;;
1,33526E+18;1,33526E+18;2020-12-05 17:33:20 Střední Evropa (běžný čas);05.12.2020;17:33:20;200;1,19078E+18;abelstavenuiter;Abstvn;;😹😹😹 A? Korona to bude furt a nesmizí;cs;[];[];[];1;0;6;[];[];https://twitter.com/abelstavenuiter/status/1335260980109041666;NEPRAVDA;https://twitter.com/bengista_/status/1335260124231983105;0;;;;;;;;[];;;;
1,33523E+18;1,33523E+18;2020-12-05 15:34:13 Střední Evropa (běžný čas);05.12.2020;15:34:13;200;2372384365;nasranytata;🇨🇿♥️🇸🇰;;Hokejové novinky v době koronaviru: na stadion může až 300 lidí  https://t.co/KjUdb7hvH5 prostřednictvím @iDNEScz větší pičoviny to ministerstvo už nevymyslí 🙏🙈;cs;[{'screen_name': 'idnescz', 'name': 'idnes.cz', 'id': '52486297'}];['https://www.idnes.cz/hokej/extraliga/koronavirus-stadion-300-lidi-podminky.A201205_150037_hokej_par&utm_source=twitter&utm_medium=sharecm'];[];1;0;3;[];[];https://twitter.com/NasranyTata/status/1335231005612003343;NEPRAVDA;;0;;;;;;;;[];;;;
1,33521E+18;1,33515E+18;2020-12-05 14:11:03 Střední Evropa (běžný čas);05.12.2020;14:11:03;200;1,31739E+18;fotrvkrizi;Fotr v krizi středního věku;;@PatoPoky @HPrahy Ještě je tam v jeskyni místo vedle VK ml. VK st. a Livie. Přeju příjemné přezimování!   A nebo zkuste s koronou bojovat jako Mach se Šebestovou 🍴🔨😂😂😂  https://t.co/3LxpDuWNdM;cs;[];[];['https://pbs.twimg.com/media/EoeefJjW8AIkAEh.jpg'];1;0;1;[];[];https://twitter.com/fotrvkrizi/status/1335210076202815488;NEPRAVDA;;1;https://pbs.twimg.com/media/EoeefJjW8AIkAEh.jpg;;;;;;;[{'screen_name': 'HPrahy', 'name': 'HolkazPrahy', 'id': '1008751848457719808'}];;;;
1,33518E+18;1,33518E+18;2020-12-05 12:21:53 Střední Evropa (běžný čas);05.12.2020;12:21:53;200;1,20117E+18;antninn;ɐnthony;;debilni prazaci za sechno muzou i za to ze je v cesku tolik korony to by se na morave nestalo😡🤬👿😠😤😾;cs;[];[];[];3;0;124;[];[];https://twitter.com/antninn/status/1335182600240062469;NEPRAVDA;;0;;;;;;;;[];;;;
1,33491E+18;1,33491E+18;2020-12-04 18:11:52 Střední Evropa (běžný čas);04.12.2020;18:11:52;200;1690464182;k_hrbkova;Kristina Hrbkova;;Odpověď cukrářů na #koronavirus 😊  https://t.co/WJ2bNvmMHZ;cs;[];[];['https://pbs.twimg.com/media/EoaMA6ZXcAENdoV.jpg'];0;0;2;['koronavirus'];[];https://twitter.com/K_Hrbkova/status/1334908290489266177;NEPRAVDA;;1;https://pbs.twimg.com/media/EoaMA6ZXcAENdoV.jpg;;;;;;;[];;;;
1,33487E+18;1,33486E+18;2020-12-04 15:21:37 Střední Evropa (běžný čas);04.12.2020;15:21:37;200;8,32514E+17;motanelek;Motanel '84➡️🇨🇿🇱🇻🇸🇰🇦🇺🇮🇹🇦🇹🇺🇸;;@lubomir_volny Spodní koronavirus 👆😂😂😂;cs;[];[];[];0;0;0;[];[];https://twitter.com/motanelek/status/1334865445791420416;NEPRAVDA;;0;;;;;;;;[{'screen_name': 'lubomir_volny', 'name': 'Lubomír Volný - VOLNÝ blok', 'id': '930746503701909504'}];;;;
1,33484E+18;1,33484E+18;2020-12-04 13:48:19 Střední Evropa (běžný čas);04.12.2020;13:48:19;200;1,21523E+18;reptileofdoom;autumn🍂;;CO TO JE ZA REKLAMU????  https://t.co/U2IELZJW2v zabíjí jako koronavirus 😭;cs;[];['https://youtu.be/8rBdCSjsqQg'];[];0;0;2;[];[];https://twitter.com/reptileofdoom/status/1334841965733670913;NEPRAVDA;https://twitter.com/reptileofdoom/status/1334841567090241538;0;;;;;;;;[];;;;
1,3348E+18;1,3348E+18;2020-12-04 11:14:51 Střední Evropa (běžný čas);04.12.2020;11:14:51;200;9,55041E+17;nedynadija;Nedy;;"""vakcína proti koronaviru bude zřejmě nepříjemnější než vakc. proti chřipce"". ""Protože, v průměru, je covid o hodně horší onemoc. než chřipka.""   Bývalý komisař amerického regulačního úřadu potravin a léků FDA Mark McClellan.   😅😆";cs;[];[];[];0;0;7;[];[];https://twitter.com/NedyNadija/status/1334803344074960897;NEPRAVDA;;0;;;;;;;;[];;;;
1,33445E+18;1,33445E+18;2020-12-03 12:09:57 Střední Evropa (běžný čas);03.12.2020;12:09:57;200;7,95261E+17;chyba_systemu;Chyba Systému;;Bývalí američtí prezidenti a například také britský premiér Boris Johnson se nachají veřejně naočkovat ve snaze vzbudit důvěru v nově schválenou vakcínu proti koronaviru ... Konspirátoři už ale ví,že jim tu vakcínu ve skutečnosti nepíchnou,že jde jen o placebo a vše je jinak...😂;cs;[];[];[];3;0;16;[];[];https://twitter.com/chyba_systemu/status/1334454824667131904;NEPRAVDA;;0;;;;;;;;[];;;;
1,3344E+18;1,3344E+18;2020-12-03 08:35:18 Střední Evropa (běžný čas);03.12.2020;8:35:18;200;810338448;radkakazdova;Radka;;"@bozena_zena Včera jsem dostala pozvání na akci 19. prosince. 25 lidí v bytě o 60 m2, protože „konec korony přece musíme oslavit!"" 😂";cs;[];[];[];1;0;5;[];[];https://twitter.com/RadkaKazdova/status/1334400803386355712;NEPRAVDA;;0;;;;;;;;[{'screen_name': 'bozena_zena', 'name': 'Boženka', 'id': '1118192676644454400'}];;;;
1,33438E+18;1,33438E+18;2020-12-03 07:23:51 Střední Evropa (běžný čas);03.12.2020;7:23:51;200;1,24852E+18;zapiskyzep;Zápisky z epidemie;;ANKETA: Většina ministrů se nechá očkovat proti koronaviru. Váhá Babiš, Brabec i prezident Zeman  Tedy dva vrcholní představitelé země, kteří by měli jít příkladem, aby byli vzorem pro lidi a bojovali vůči očkovacím předsudkům, opět nezklamali 🙈👎🏻;cs;[];[];[];0;1;28;[];[];https://twitter.com/zapiskyzep/status/1334382825328545792;NEPRAVDA;;0;;;;;;;;[];;;;
1,33419E+18;1,33419E+18;2020-12-02 18:52:35 Střední Evropa (běžný čas);02.12.2020;18:52:35;200;2863411787;i_dontsendnudes;🦇🧜🏻‍♀️❄️;;@tvojepoleva Ahaaa😂 no ja myslela jakože v praze(vim ze nejsi primo od tama ) no doufam ze jen v karantene bez korony;cs;[];[];[];1;0;0;[];[];https://twitter.com/i_dontsendnudes/status/1334193763128930306;NEPRAVDA;;0;;;;;;;;[];;;;
1,33418E+18;1,33418E+18;2020-12-02 17:52:47 Střední Evropa (běžný čas);02.12.2020;17:52:47;200;7,47847E+17;bartosvl;Vladimír Bartoš;;Miroslav H. – měl před dvěma týdny všechny příznaky koronaviru. Vyležel se doma a na testy nešel. „Už takhle sotva vyjdeme s penězma, představa, že půjdu marodit za šedesát procent a budu doma třeba měsíc, je nemyslitelná.  Hlásím poruchu v testování 🤔😂  https://t.co/CDszXCqUHC;cs;[];['https://www.idnes.cz/zpravy/domaci/cesko-koronavirus-vysetreni-karantena-prace-penize.A201201_213412_domaci_mama?zdroj=top'];[];7;3;35;[];[];https://twitter.com/BartosVl/status/1334178712418480129;NEPRAVDA;;0;;;;;;;;[];;;;
1,33412E+18;1,33411E+18;2020-12-02 14:11:20 Střední Evropa (běžný čas);02.12.2020;14:11:20;200;1,22396E+18;malejgremlin;jsemkoťatko;;@kebabscibuli Ja mam 23k a to jsem mela spotify od 1. Vlny korony teprv + posloucham hodne i na ytbku😳;cs;[];[];[];1;0;4;[];[];https://twitter.com/malejgremlin/status/1334122980851535874;NEPRAVDA;;0;;;;;;;;[{'screen_name': 'kebabscibuli', 'name': 'luca🖇️', 'id': '973682634432925699'}];;;;
1,33405E+18;1,33405E+18;2020-12-02 09:07:33 Střední Evropa (běžný čas);02.12.2020;9:07:33;200;1,21569E+18;vylitesrdicko;Eva;;Uz to bude skoro rok, co jsem kvuli korone nebyla na treninku. Nejenze ze se tam vratim a zjistim, ze jsem z celyho tymu nejvic pribrala ale ani uz nebudu umet tancovat😭😭;cs;[];[];[];0;0;2;[];[];https://twitter.com/vylitesrdicko/status/1334046533109608449;NEPRAVDA;;0;;;;;;;;[];;;;
1,33382E+18;1,33382E+18;2020-12-01 17:54:21 Střední Evropa (běžný čas);01.12.2020;17:54:21;200;1,20718E+18;namjinsbabygrrl;ia🐣anu⁷older sis☀|SEOKJINNIE CULT|;;ja si zkusila nastrikat do nosa a pali to jeste vic lmao 😹 ja zhebnu uz, proc zas ja musim mit po korone takovy problemy???;cs;[];[];[];1;0;2;[];[];https://twitter.com/namjinsbabygrrl/status/1333816718028836867;NEPRAVDA;;0;;;;;;;;[];;;;
1,33378E+18;1,33378E+18;2020-12-01 15:46:27 Střední Evropa (běžný čas);01.12.2020;15:46:27;200;9,63814E+17;nezapadas;Hhela⁷;;@cernocerna jjj ale ted tam nechodim kvuli korone😰;cs;[];[];[];0;0;1;[];[];https://twitter.com/nEzApAdAs/status/1333784530130407426;NEPRAVDA;;0;;;;;;;;[{'screen_name': 'cernocerna', 'name': 'ultimate fan girl', 'id': '1098497945027182592'}];;;;
1,33378E+18;1,33378E+18;2020-12-01 15:13:01 Střední Evropa (běžný čas);01.12.2020;15:13:01;200;4373230119;victor_tovikrov;Victor_T ✌️🇺🇦 🖕🇷🇺;;Další skvělý článek, tentokrát o tom, jak 2měsíční jarní zmatky ohledně asymptomatického přenosu (samozřejmě opět rozdmýchávané WHO) vedly k mnohem většímu rozšíření koronaviru, a to i přes opakované upozorňování doktorů, že se to děje 😷   https://t.co/9JhcSDg9VA;cs;[];['https://www.nytimes.com/2020/06/27/world/europe/coronavirus-spread-asymptomatic.html?action=click&module=RelatedLinks&pgtype=Article'];[];1;0;0;[];[];https://twitter.com/Victor_Tovikrov/status/1333776115840786433;NEPRAVDA;;0;;;;;;;;[];;;;
1,33371E+18;1,33371E+18;2020-12-01 10:36:47 Střední Evropa (běžný čas);01.12.2020;10:36:47;200;1,17406E+18;mannedtweets;Crewed Spaceflights Tweets;;#koronavirusvČesku 🇨🇿😷 Koronavirus v Moravskoslezském kraji.;cs;[];[];[];0;0;0;['koronavirusvčesku'];[];https://twitter.com/MannedTweets/status/1333706602139054082;NEPRAVDA;https://twitter.com/ivondrak/status/1333703707486203906;0;;;;;;;;[];;;;
1,3337E+18;1,3337E+18;2020-12-01 10:28:28 Střední Evropa (běžný čas);01.12.2020;10:28:28;200;1,28626E+18;katjuuska;káťa;;@elinalaska já tam měla letět i tenhle rok, ale ✨korona✨ 😔🖐🏻 řekla bych ještě něco ale vy se na mě naserete 😩😖💔🖐🏻;cs;[];[];[];1;0;1;[];[];https://twitter.com/katjuuska/status/1333704509558812674;NEPRAVDA;;0;;;;;;;;[];;;;
1,33369E+18;1,33369E+18;2020-12-01 09:44:37 Střední Evropa (běžný čas);01.12.2020;9:44:37;200;1,27895E+18;jan__slezak;Jan Slezák;;“Koronavirus nevznikl ve Wu-chanu.Čína se snaží pozměnit příběh o původu covidu, prý může pocházet i z Česka” tomuhle se tak nějak říká “za dobrotu na žebrotu”, že pane prezidente? 😂 https://t.co/9FA1rZxwHI;cs;[];['https://www.lidovky.cz/svet/cina-si-chce-zachranit-reputaci-snazi-se-vyvratit-puvod-koronavirove-infekce-ve-wu-chanu.A201129_115606_ln_zahranici_lihav'];[];3;0;3;[];[];https://twitter.com/Jan__Slezak/status/1333693473531322370;NEPRAVDA;;0;;;;;;;;[];;;;
1,33353E+18;1,33353E+18;2020-11-30 22:55:22 Střední Evropa (běžný čas);30.11.2020;22:55:22;200;1,15367E+18;prclikvcaju;terezie van cecek||cecki🌸✨🇺🇦;;ja chci jit ven s kamaradkou, videt vsechny moje internetovy frendy, aby nebyla zadna pico korona😭 a vanocni mesto😭. jsbsksjd;cs;[];[];[];1;0;6;[];[];https://twitter.com/prclikvcaju/status/1333530083139739650;NEPRAVDA;;0;;;;;;;;[];;;;
1,33343E+18;1,33317E+18;2020-11-30 16:26:13 Střední Evropa (běžný čas);30.11.2020;16:26:13;200;9,50851E+17;hruskapa;Pavel Hruška;;@MotejlekSkocdop Miloš Zeman zadá úkol tajným službám, aby prověřili, jestli se v ČR testoval koronavirus. Ta vojenská mu vyhoví a dodá co si přeje. 😖;cs;[];[];[];0;0;1;[];[];https://twitter.com/HruskaPa/status/1333432151455518720;NEPRAVDA;;0;;;;;;;;[{'screen_name': 'MotejlekSkocdop', 'name': 'MotejlekSkocdopole', 'id': '731425921291452416'}];;;;
1,33339E+18;1,33339E+18;2020-11-30 13:45:06 Střední Evropa (běžný čas);30.11.2020;13:45:06;200;3957070513;dvovaclav;Václav Dvořák;;Čínští vědci pobavili: Koronavirus pochází i z Česka 😂;cs;[];[];[];0;0;0;[];[];https://twitter.com/DvoVaclav/status/1333391603357118464;NEPRAVDA;;0;;;;;;;;[];;;;
1,33335E+18;1,33331E+18;2020-11-30 10:40:51 Střední Evropa (běžný čas);30.11.2020;10:40:51;200;9,65955E+17;mudra_radek;Radek Mudra;;@Aktualnecz Jinými slovy se ještě nestal ani prezidentem ani president-elect, ale už je v horším zdravotním stavu, než byl Trump za celé čtyři roky. A ten prodělal koronavirus.  😂😂😂;cs;[];[];[];1;0;0;[];[];https://twitter.com/mudra_radek/status/1333345235502567425;NEPRAVDA;;0;;;;;;;;[{'screen_name': 'Aktualnecz', 'name': 'Aktuálně.cz', 'id': '63115636'}];;;;
1,33331E+18;1,33331E+18;2020-11-30 08:16:42 Střední Evropa (běžný čas);30.11.2020;8:16:42;200;7,21972E+17;bm_enefa;Bramhorka 🥔🏔️;;Se taky pochlubím 😉  Včetně korony a dračích vajíček 😉😂  https://t.co/8XNbf9Op49;cs;[];[];['https://pbs.twimg.com/media/EoDdanvW8AAHMbe.jpg', 'https://pbs.twimg.com/media/EoDdbCCWEAESdBV.jpg', 'https://pbs.twimg.com/media/EoDdbaNW4AEIuvp.jpg', 'https://pbs.twimg.com/media/EoDdbtRW8AA_r9P.jpg'];0;0;1;[];[];https://twitter.com/bm_enefa/status/1333308962385633280;NEPRAVDA;;1;https://pbs.twimg.com/media/EoDdanvW8AAHMbe.jpg;;;;;;;[];;;;
1,33316E+18;1,33316E+18;2020-11-29 22:09:06 Střední Evropa (běžný čas);29.11.2020;22:09:06;200;7,10034E+17;h_langsadlova;Helena Langšádlová;;Tak Rusko na nás chtelo hodit novičok a Čína teď koronavirus😂  https://t.co/A5gbEe3bhR;cs;[];['https://www.lidovky.cz/svet/cina-si-chce-zachranit-reputaci-snazi-se-vyvratit-puvod-koronavirove-infekce-ve-wu-chanu.A201129_115606_ln_zahranici_lihav'];[];12;10;67;[];[];https://twitter.com/H_Langsadlova/status/1333156051449950215;NEPRAVDA;;0;;;;;;;;[];;;;
1,33314E+18;1,33314E+18;2020-11-29 21:14:14 Střední Evropa (běžný čas);29.11.2020;21:14:14;200;1,17406E+18;mannedtweets;Crewed Spaceflights Tweets;;Koronavirus na Islandu 🇮🇸😷 Jde to i bez zavírání hranic a obchodů. Island se vydal cestou vědy  https://t.co/4yTQnCutKk prostřednictvím @SeznamZpravy;cs;[{'screen_name': 'seznamzpravy', 'name': 'seznam zprávy', 'id': '723053842267398144'}];['https://www.seznamzpravy.cz/clanek/jde-to-i-bez-zavirani-hranic-a-obchodu-island-se-vydal-cestou-vedy-131545#utm_source=twitter&utm_medium=sharebt&utm_campaign=bottom'];[];0;0;0;[];[];https://twitter.com/MannedTweets/status/1333142246452031488;NEPRAVDA;;0;;;;;;;;[];;;;
1,33314E+18;1,33314E+18;2020-11-29 20:57:20 Střední Evropa (běžný čas);29.11.2020;20:57:20;200;7,09391E+17;jiristefek;Jiří Štefek;;"STEM/MARK: ""Celkem 17 procent lidí soudí, že nynější koronavirovou krizi zvládla současná menšinová vláda ANO a ČSSD dobře."" Až dojde rouškovné, třeba se to změní....🙈🤣🤓 #COVID19 #koronavirus #CzechRepublic #vlada #epidemie";cs;[];[];[];0;0;0;['covid19', 'koronavirus', 'czechrepublic', 'vlada', 'epidemie'];[];https://twitter.com/JiriStefek/status/1333137992345653248;NEPRAVDA;;0;;;;;;;;[];;;;
1,33313E+18;1,33313E+18;2020-11-29 20:33:07 Střední Evropa (běžný čas);29.11.2020;20:33:07;200;1650734636;dyingbuttrying_;Ψmy name is lameΨ;;-nejsem na tebe hnusnej ne? +tak proc brecim snad pokazdy kdyz se vidime?😀 -tak ty se rozbrecis kvuli vsemu vole, pustis si 1975 a zacnes brecet, zes kvuli korone nemohla na koncert, to se fakt neda, a pak mi to budes vycitat, ze TY brecis  😂😂😂 jo ma zas pravdu;cs;[];[];[];0;0;1;[];[];https://twitter.com/dyingbuttrying_/status/1333131896721641473;NEPRAVDA;;0;;;;;;;;[];;;;
1,33308E+18;1,33308E+18;2020-11-29 16:50:34 Střední Evropa (běžný čas);29.11.2020;16:50:34;200;1,14975E+18;vhorajdaa;v_horakovaa;;Korona mi sebrala vánoční mood😭;cs;[];[];[];1;0;19;[];[];https://twitter.com/vhorajdaa/status/1333075889979056128;NEPRAVDA;;0;;;;;;;;[];;;;
1,33303E+18;1,33299E+18;2020-11-29 13:36:50 Střední Evropa (běžný čas);29.11.2020;13:36:50;200;1,22027E+18;curious72475327;Kačaba;;@ester_vanis @annasulcova Já naposled před koronou a to už je “let”😭🤣;cs;[];[];[];0;0;4;[];[];https://twitter.com/CURIOUS72475327/status/1333027137251647489;NEPRAVDA;;0;;;;;;;;[{'screen_name': 'ester_vanis', 'name': 'Ester Vanišová', 'id': '1127537191759097856'}, {'screen_name': 'annasulcova', 'name': 'Anna Šulcová', 'id': '2744388988'}];;;;
1,33299E+18;1,33299E+18;2020-11-29 11:28:16 Střední Evropa (běžný čas);29.11.2020;11:28:16;200;1,24276E+18;mochezke;mio ꩜;;jooo konecne konec karanteny brasko 😜😜😜😜😜😜😜🙈🙈🙈🙈🙈 vsichni pojdme mega moc nakupovat na vanoce a oslavovat silvestr jooo uz je totiz konec korony 😜😜😁😁😁🙈🙈🙈🙈 konecne konec proste pojdme se socializovat 😁😁😁😁😜☺️☺️☺️☺️☺️;cs;[];[];[];0;0;4;[];[];https://twitter.com/mochezke/status/1332994781543337985;NEPRAVDA;https://twitter.com/kelisakova/status/1332989470740721668;0;;;;;;;;[];;;;
1,33282E+18;1,33282E+18;2020-11-28 23:38:02 Střední Evropa (běžný čas);28.11.2020;23:38:02;200;3031166890;blacky059;KAREL HYNEK BRÁCHA;;@natymotyy Pozve mě k sobě na oslavu v šesti lidech až v půl dvanáctý večer, když ví, že takhle večer v koroně už nic nejezdi   Jsem angry 😡;cs;[];[];[];0;0;1;[];[];https://twitter.com/blacky059/status/1332816044294107136;NEPRAVDA;;0;;;;;;;;[{'screen_name': 'natymotyy', 'name': 'natálie', 'id': '2250982689'}];;;;
1,33277E+18;1,33276E+18;2020-11-28 20:27:56 Střední Evropa (běžný čas);28.11.2020;20:27:56;200;1242038797;zimzalajin;majda⁷;;@moonkid520 aaa jo vlastně😭 tak třeba po korone v nějakým klubu no😂;cs;[];[];[];1;0;1;[];[];https://twitter.com/zimzalajin/status/1332768205891399680;NEPRAVDA;;0;;;;;;;;[{'screen_name': 'moonkid520', 'name': 'Aurelia⁷읏 |SEOKJINNIE CULT|', 'id': '1290554322258989056'}];;;;
1,33271E+18;1,33271E+18;2020-11-28 16:31:25 Střední Evropa (běžný čas);28.11.2020;16:31:25;200;1,15886E+18;liskaprazska;Prazska Liska 🇺🇦;;Adventni trhy ve stylu zima a korona. 😂  https://t.co/Jb442mM1rH;cs;[];[];['https://pbs.twimg.com/media/En67erMXcAUbG-u.jpg'];0;0;2;[];[];https://twitter.com/LiskaPrazska/status/1332708684246478848;NEPRAVDA;;1;https://pbs.twimg.com/media/En67erMXcAUbG-u.jpg;;;;;;;[];;;;
1,33262E+18;1,33262E+18;2020-11-28 10:24:45 Střední Evropa (běžný čas);28.11.2020;10:24:45;200;50296368;patriknacher;Patrik Nacher;;Rozsvěcení vánočního stromu na Staromáku věrně popisuje aktuální dobu. Dlouho to bylo normální, pak přišly roky, kdy se akce musela přizpůsobit bezpečnostní situaci kvůli hrozbě terorismu a letos bude jen videozáznam kvůli koronaviru. Co bude příští rok?😱  https://t.co/cdoOncrfjH;cs;[];['https://www.novinky.cz/domaci/clanek/praha-tajne-rozsvitila-vanocni-strom-40343589#dop_ab_variant=0&dop_req_id=7taUQxVl7Lo-202011280604&dop_source_zone_name=novinky.sznhp.box&source=hp&seq_no=8&utm_campaign=&utm_medium=z-boxiku&utm_source=www.seznam.cz'];[];5;1;22;[];[];https://twitter.com/PatrikNacher/status/1332616408178495488;NEPRAVDA;;0;;;;;;;;[];;;;
1,33257E+18;1,33257E+18;2020-11-28 07:20:13 Střední Evropa (běžný čas);28.11.2020;7:20:13;200;70725936;irozhlascz;iROZHLAS.cz;;😷4458 nových případů covidu-19, což je o 1350 méně než před týdnem. Dění kolem koronaviru můžete sledovat v naší online reportáži.  https://t.co/cUvhyKCTwM;cs;[];['http://irozhl.as/bXs'];[];1;2;3;[];[];https://twitter.com/iROZHLAScz/status/1332569969217900545;NEPRAVDA;;0;;;;;;;;[];;;;
1,33233E+18;1,33233E+18;2020-11-27 15:30:23 Střední Evropa (běžný čas);27.11.2020;15:30:23;200;575803494;olympijskytym;Český olympijský tým;;50 dní ❗️ Tak dlouho neviděli klienti mlékovického Domova Clementas své blízké kvůli koronaviru. 👨‍👩‍👦‍👦 Dnes se senioři konečně dočkali! 🚛 Olympijský setkávač totiž přijel rozdávat radost. 😍  https://t.co/Ze4uncMgaV;cs;[];[];['https://pbs.twimg.com/media/En1jgFaW4AA68b3.jpg', 'https://pbs.twimg.com/media/En1jjPwXYAg2baB.jpg', 'https://pbs.twimg.com/media/En1jm9bW4AAFeYn.jpg', 'https://pbs.twimg.com/media/En1jpE_W4AApWxh.jpg'];0;1;19;[];[];https://twitter.com/olympijskytym/status/1332330938051735557;NEPRAVDA;;1;https://pbs.twimg.com/media/En1jgFaW4AA68b3.jpg;;;;;;;[];;;;
1,33231E+18;1,33228E+18;2020-11-27 14:26:04 Střední Evropa (běžný čas);27.11.2020;14:26:04;200;743335034;adelay94;Errol;;@AndreaTweetuje Abych neznělá tak moc jako snobska honorace, tak dodám, ze do korony jsem dělala u aerolinek, takže letenky za pakatel 😂😊;cs;[];[];[];0;0;0;[];[];https://twitter.com/Adelay94/status/1332314749560889347;NEPRAVDA;;0;;;;;;;;[{'screen_name': 'Andreatweetuje', 'name': 'Andrea', 'id': '1627387093'}];;;;
1,3321E+18;1,32621E+18;2020-11-27 00:06:12 Střední Evropa (běžný čas);27.11.2020;0:06:12;200;1,31997E+18;ceskasada;Česká sada;;@lidovky @RobertPlaga To všechno, co tvrdíte o on-line a distanční výuce, je pravda. Jenže realita je někde úplně jinde. Nepodařilo se Vám distanční výuku na solidní úrovni zavést, podcenili jste přípravu, vařilo se narychlo a z vody. Stejně jako premiér a zbytek vlády v souvislosti s koronavirem. 👎;cs;[];[];[];0;0;0;[];[];https://twitter.com/CeskaSada/status/1332098356676612098;NEPRAVDA;;0;;;;;;;;[{'screen_name': 'lidovky', 'name': 'Lidovky.cz', 'id': '46105253'}, {'screen_name': 'RobertPlaga', 'name': 'Robert Plaga', 'id': '906667104'}];;;;
1,33207E+18;1,33207E+18;2020-11-26 22:03:36 Střední Evropa (běžný čas);26.11.2020;22:03:36;200;1,1447E+18;carbergoss;adamosak;;od korony jsem zacal hodne cvicit a oplaci se😤;cs;[];[];[];1;0;3;[];[];https://twitter.com/carbergoss/status/1332067506836664326;NEPRAVDA;;0;;;;;;;;[];;;;
1,33206E+18;1,33169E+18;2020-11-26 21:50:30 Střední Evropa (běžný čas);26.11.2020;21:50:30;200;1,21918E+18;filia_tenebris_;Filia Tenebris;;@mattemwow Čas bez korony v kině -uvadec: přeji hezkou zabavu -já a moje kamoška: my vám taky -Also my: 😳🤦🏻‍♀️;cs;[];[];[];0;0;0;[];[];https://twitter.com/filia_tenebris_/status/1332064210147282946;NEPRAVDA;;0;;;;;;;;[{'screen_name': 'mattemwow', 'name': 'Maty(ando)', 'id': '1069302086293233664'}];;;;
1,33201E+18;1,33201E+18;2020-11-26 18:29:24 Střední Evropa (běžný čas);26.11.2020;18:29:24;200;1,20718E+18;namjinsbabygrrl;ia🐣anu⁷older sis☀|SEOKJINNIE CULT|;;ja doufam ze se mi uz brzo vrati cich tvl, od korony mam 8 tydnu a porad nic 😭😭😭;cs;[];[];[];0;0;1;[];[];https://twitter.com/namjinsbabygrrl/status/1332013599682949123;NEPRAVDA;;0;;;;;;;;[];;;;
1,33194E+18;1,33193E+18;2020-11-26 13:35:05 Střední Evropa (běžný čas);26.11.2020;13:35:05;200;131415435;keyur_l;Keyur Lunagariya;;@nikunjhpanchal Korona ni expiry date su chhe?? 😂😂;cs;[];[];[];0;0;2;[];[];https://twitter.com/keyur_l/status/1331939534758498314;NEPRAVDA;;0;;;;;;;;[{'screen_name': 'nikunjhpanchal', 'name': 'Nikunj Panchal', 'id': '1602688531'}];;;;
1,33194E+18;1,33171E+18;2020-11-26 13:28:18 Střední Evropa (běžný čas);26.11.2020;13:28:18;200;8,78323E+17;hanuskatomas;Tomas Hanuska;;@Telicka @ZdravkoOnline @AndrejBabis Když pan Blatný začínal tak pronesl, že je zapotřebí nemít z koronaviru strach, ale respekt. Podle jeho posledního vyjádření se tím vůbec neřídí! 😷 https://t.co/x6Oxq6PY2s;cs;[];['https://www.ceskenoviny.cz/zpravy/novy-ministr-blatny-chce-zmenit-strach-z-koronaviru-v-respekt/1951582'];[];0;0;1;[];[];https://twitter.com/HanuskaTomas/status/1331937824191492097;NEPRAVDA;;0;;;;;;;;[{'screen_name': 'Telicka', 'name': 'Pavel Telička', 'id': '2317789460'}, {'screen_name': 'ZdravkoOnline', 'name': 'Ministerstvo zdravotnictví', 'id': '3293937255'}, {'screen_name': 'AndrejBabis', 'name': 'Andrej Babiš', 'id': '713035525'}];;;;
1,33188E+18;1,33188E+18;2020-11-26 09:30:37 Střední Evropa (běžný čas);26.11.2020;9:30:37;200;1,22245E+18;zuzana51325689;Zuziii;;Korona posraná..😖 mám o vás strach 🥺🙏💫;cs;[];[];[];0;0;14;[];[];https://twitter.com/Zuzana51325689/status/1331878010866327552;NEPRAVDA;;0;;;;;;;;[];;;;
