id;conversation_id;created_at;date;time;timezone;user_id;username;name;place;tweet;language;mentions;urls;photos;replies_count;retweets_count;likes_count;hashtags;cashtags;link;retweet;quote_url;video;thumbnail;near;geo;source;user_rt_id;user_rt;retweet_id;reply_to;retweet_date;translate;trans_src;trans_dest
1,32917E+18;1,32917E+18;2020-11-18 22:04:39 Střední Evropa (běžný čas);18.11.2020;22:04:39;200;8,20693E+17;midlinka1967;Nemilosrdná čarodějnice Saxana 🇨🇿🇷🇺🔥🕷🖤;;Venčení psů a dovážky z obchodů zvyšují riziko nákazy koronavirem, tvrdí studie   https://t.co/XZcT0Al38c Mám pocit,že idioti padají z nebe😂😂☝️jak chvoj Perseidů.;cs;[];['https://cnn.iprima.cz/venceni-psu-a-dovazky-z-obchodu-zvysuji-riziko-nakazy-covid-19-tvrdi-studie-13504'];[];6;0;16;[];[];https://twitter.com/Midlinka1967/status/1329168668459225098;NEPRAVDA;;0;;;;;;;;[];;;;
1,32913E+18;1,32913E+18;2020-11-18 19:45:00 Střední Evropa (běžný čas);18.11.2020;19:45:00;200;60629880;hospodarky;Hospodářské noviny;;💰 NEJDRAŽŠÍ MĚSTA NA SVĚTĚ  Koronavirus zamíchal pořadím měst, ve kterých je život nejdražší. Na vrchních příčkách žebříčku vystřídaly asijské metropole Paříž a Curych, které nyní sdílí první místo spolu s Hong Kongem.  https://t.co/bQJNJljqRv;cs;[];['https://zahranicni.ihned.cz/c1-66845780-cenami-v-metropolich-zamaval-koronavirus-nejdraz-se-zije-v-parizi-hong-kongu-a-curychu'];[];1;0;0;[];[];https://twitter.com/hospodarky/status/1329133521298927616;NEPRAVDA;;0;;;;;;;;[];;;;
1,3291E+18;1,3291E+18;2020-11-18 17:36:17 Střední Evropa (běžný čas);18.11.2020;17:36:17;200;1,30476E+18;hug4sylvee;eli/ocean¹⁴³💙💛JULES DAY;;omg vcera mela ms korona narozky a my to propasli💔😭;cs;[];[];[];0;0;6;[];[];https://twitter.com/hug4sylvee/status/1329101131037937664;NEPRAVDA;;0;;;;;;;;[];;;;
1,32909E+18;1,32909E+18;2020-11-18 16:49:42 Střední Evropa (běžný čas);18.11.2020;16:49:42;200;133638824;ondrejpales;Ondrej Páleš ✈️🛰🚀;;@_sukovf @KarelHavlicek_ No ovšem jestli se všichni tak hrnou nakupovat zeleninu zrovna v Kauflandu, tak koronavirus není jejich největší zdravotní riziko. 😂;cs;[];[];[];0;0;1;[];[];https://twitter.com/ondrejpales/status/1329089407912083459;NEPRAVDA;;0;;;;;;;;[{'screen_name': '_sukovf', 'name': 'Martin Souček', 'id': '1316022847'}, {'screen_name': 'KarelHavlicek_', 'name': 'Karel Havlíček', 'id': '1105851826702897152'}];;;;
1,32903E+18;1,32903E+18;2020-11-18 12:38:48 Střední Evropa (běžný čas);18.11.2020;12:38:48;200;440694594;janahrbkova;Jana Hrbková;;😥 Koronaviru podlehla 39letá zdravotní sestra z Jihlavy. Zůstala po ní malá dcera  https://t.co/XqTOmW1KB3;cs;[];['https://cnn.iprima.cz/koronaviru-podlehla-mlada-zdravotni-sestra-z-jihlavy-mela-sedmiletou-dceru-13530'];[];0;0;0;[];[];https://twitter.com/janahrbkova/status/1329026267509829632;NEPRAVDA;;0;;;;;;;;[];;;;
1,32903E+18;1,32903E+18;2020-11-18 12:38:01 Střední Evropa (běžný čas);18.11.2020;12:38:01;200;459933658;ozdravotnictvi;ozdravotnictví.cz;;Orientaci v široké nabídce roušek a respirátorů usnadní lidem v době pandemie koronaviru přehled značení a účinnosti pomůcek pro ochranu dýchacích cest, který vytvořili na Fakultě tělesné kultury Univerzity Palackého v Olomouci. 😷 https://t.co/1hA5sf1tbr;cs;[];['https://www.ozdravotnictvi.cz/zpravodajstvi/prehled-znaceni-rousek-a-respiratoru/'];[];0;0;0;[];[];https://twitter.com/ozdravotnictvi/status/1329026067353509889;NEPRAVDA;;0;;;;;;;;[];;;;
1,32879E+18;1,32879E+18;2020-11-17 21:05:11 Střední Evropa (běžný čas);17.11.2020;21:05:11;200;473000531;milevaivanovic;Milva;;Nedostaje mi prvi talas korony, tad smo se svi lEpo družyly i poštyvaly 💔;cs;[];[];[];0;0;14;[];[];https://twitter.com/MilevaIvanovic/status/1328791314465435651;NEPRAVDA;;0;;;;;;;;[];;;;
1,32877E+18;1,32877E+18;2020-11-17 19:40:48 Střední Evropa (běžný čas);17.11.2020;19:40:48;200;1,01894E+18;dominikqwer;dominik;;*nikdo nic*  češi: buuuuuu korona je výmysl, nechceme roušky, roušky jsou zlooo, stát si z nás dělá blázny🤡😡😡😡😡😡😡😡😡😡😡😡😡😡😡😡😡😡😡😡😡😡😡😡😡😡😡😡😡😡😡😡😡😡😡😡😡😡😡😡😡😡😡😡😡😡😡😡😡😡😡😡😡😡😡😡😡😡😡😡😡😡😡😡😡😡😡😡😡😡😡😡😡😡😡😡😡😡😡😡😡😡😡😡😡😡😡;cs;[];[];[];0;0;2;[];[];https://twitter.com/dominikqwer/status/1328770075617353729;NEPRAVDA;;0;;;;;;;;[];;;;
1,32867E+18;1,32844E+18;2020-11-17 13:08:21 Střední Evropa (běžný čas);17.11.2020;13:08:21;200;1,25506E+18;elissimandlova;Elis Šimandlová;;"@HedaSpodarova Včera do mě u pokladny jeden důchodce dvakrát strčil košíkem. Poprvé jsem se jen otočila s pohledem ,,děláš si prdel?"". Podruhé jsem k tomu ještě schválně zakašlala. A byl klid 🤣 tohle dejchání za krk ve frontě nesnášim, korona nekorona😡";cs;[];[];[];0;0;1;[];[];https://twitter.com/ElisSimandlova/status/1328671316065611777;NEPRAVDA;;0;;;;;;;;[{'screen_name': 'HedaSpodarova', 'name': 'Heda Spoďárová', 'id': '755061669538197504'}];;;;
1,32865E+18;1,32838E+18;2020-11-17 11:43:37 Střední Evropa (běžný čas);17.11.2020;11:43:37;200;841364821;luboszabojnik;Luboš Zábojník;;@iva_pileckova Letos jsem běhání po obchodech vzdal. Ne kvůli koronaviru, jen se chci vyhnout shonu. V e-shopech opatřené dárky už jsou na cestě. Zbývá mi koupit jeden. Na internetu jsem rovněž vybral balicí papír. Těším se na balení a rozdávání dárků, tentokrát jich bude víc než jindy. 😊;cs;[];[];[];1;0;2;[];[];https://twitter.com/LubosZabojnik/status/1328649991502622721;NEPRAVDA;;0;;;;;;;;[{'screen_name': 'iva_pileckova', 'name': 'Iva Pilečková', 'id': '2908334879'}];;;;
1,32863E+18;1,32863E+18;2020-11-17 10:16:11 Střední Evropa (běžný čas);17.11.2020;10:16:11;200;861028651;e15news;E15news;;👩‍⚕️💉 Stát už chystá pravidla pro plošné očkování proti koronaviru. @nguyenthuongly zjistila, kolik bude první fáze očkování stát 💰#koronavirus #COVID19   https://t.co/xXLuTwt6v8;cs;[{'screen_name': 'nguyenthuongly', 'name': 'nguyen thuong ly', 'id': '2592822054'}];['https://www.e15.cz/domaci/prvni-faze-plosneho-ockovani-proti-koronaviru-vyjde-stat-na-vice-nez-miliardu-pro-lidi-nebude-povinne-1375285'];[];1;1;2;['koronavirus', 'covid19'];[];https://twitter.com/E15news/status/1328627988129341441;NEPRAVDA;;0;;;;;;;;[];;;;
1,3286E+18;1,3286E+18;2020-11-17 08:20:35 Střední Evropa (běžný čas);17.11.2020;8:20:35;200;1,13145E+18;michaelaurban14;Aj Chua Peace for Ukraine 💙💛 #FCKPutin!;;@PJechort mno .. na jaře v koroně, jsem byla denně doma, balík nedoručen .. i přeobjednala jsem si doručení na 21. hodinu za 21 Kč, načež mi chlapík volá v půl 16, že mi ho veze :)) fakt jsem ho odmítla! 😂a řekla že ho chci přivézt ve 21 hodin, doma jsem byla 😂 jak vy, tak my😂;cs;[];[];[];1;0;1;[];[];https://twitter.com/MichaelaUrban14/status/1328598894708711424;NEPRAVDA;;0;;;;;;;;[{'screen_name': 'PJechort', 'name': 'Pavel Jechort 🇺🇦', 'id': '1128060740'}];;;;
1,32859E+18;1,32844E+18;2020-11-17 07:43:25 Střední Evropa (běžný čas);17.11.2020;7:43:25;200;1,10374E+18;fpatyzon;Franz Patyzon;;@JiriSimon @AdamekMiroslav žvást? nějak jsem si nevšiml, že by se rusko zbavilo koronaviru. naopak, nakažených mají čím dál víc😂;cs;[];[];[];1;0;0;[];[];https://twitter.com/FPatyzon/status/1328589543898034177;NEPRAVDA;;0;;;;;;;;[{'screen_name': 'JiriSimon', 'name': 'jiří šimon', 'id': '3532764495'}, {'screen_name': 'AdamekMiroslav', 'name': 'M', 'id': '1275812937517711362'}];;;;
1,32859E+18;1,32859E+18;2020-11-17 07:41:18 Střední Evropa (běžný čas);17.11.2020;7:41:18;200;70725936;irozhlascz;iROZHLAS.cz;;V pondělí přibylo v Česku 5406 potvrzených nákaz koronavirem. Je to o 642 méně než před týdnem. Vyléčilo se 341 249 lidí, tedy téměř tři čtvrtiny dosud nakažených.😷  https://t.co/ACTz6JODG2;cs;[];['http://irozhl.as/bQM'];[];1;1;5;[];[];https://twitter.com/iROZHLAScz/status/1328589008834867201;NEPRAVDA;;0;;;;;;;;[];;;;
1,32848E+18;1,32848E+18;2020-11-17 00:45:50 Střední Evropa (běžný čas);17.11.2020;0:45:50;200;1,0157E+18;ivetsterzlova;Ivet Šterzlova;;Si rezervuju u tebe místo a až skončí korona tak za tebou se vrátím a budeme spolu😂😂😂😂😂😂😂;cs;[];[];[];1;0;1;[];[];https://twitter.com/ivetsterzlova/status/1328484453065367553;NEPRAVDA;;0;;;;;;;;[];;;;
1,32843E+18;1,32843E+18;2020-11-16 21:12:37 Střední Evropa (běžný čas);16.11.2020;21:12:37;200;1,20217E+18;simatremlova;Simonka;;Kdo ještě neměl setkaní s bengama při koroně tak nežije😂;cs;[];[];[];2;1;28;[];[];https://twitter.com/SimaTremlova/status/1328430796672278529;NEPRAVDA;;0;;;;;;;;[];;;;
1,32841E+18;1,32841E+18;2020-11-16 20:05:03 Střední Evropa (běžný čas);16.11.2020;20:05:03;200;41081945;clovekvtisni;Člověk v tísni;;Naše kolegyně Jana Maříková o své práci, klientech, rodině a o tom,  jaké to je začínat se sociálními službami v době koronaviru 🔛📞😣📲 🤔    #PomáhámevČesku #SociálníPráce    https://t.co/drcXKJFBMS;cs;[];['https://www.clovekvtisni.cz/vuci-lidem-se-socialnim-znevyhodnenim-nikdo-soucit-sympatie-nebo-ohleduplnost-nechova-7173gp?fbclid=IwAR2e5wupkl07mRXvQ0XpLv0S56OnNqA-LQfqsjsrtRX0uWLGibn8vDE-3bA'];[];0;1;3;['pomáhámevčesku', 'sociálnípráce'];[];https://twitter.com/CLOVEKVTISNI/status/1328413793702064133;NEPRAVDA;;0;;;;;;;;[];;;;
1,3284E+18;1,3284E+18;2020-11-16 19:05:13 Střední Evropa (běžný čas);16.11.2020;19:05:13;200;3500493496;nadacevodafone;Nadace Vodafone;;💕Jak se proměnilo seznamovaní za poslední roky a kam ho posunula současná pandemie koronaviru...🦠  👉Sledujte ve čtvrtek na  https://t.co/Ad43VGqFQ8  #connectingforgood #technologiepomahaji #tech4good #pripojtese  https://t.co/NsPflNtx2X;cs;[];['http://fb.me/e/1BpU3rDbj'];['https://pbs.twimg.com/media/Em9rmwsXEAQJRHN.jpg'];0;0;4;['connectingforgood', 'technologiepomahaji', 'tech4good', 'pripojtese'];[];https://twitter.com/NadaceVodafone/status/1328398734749814787;NEPRAVDA;;1;https://pbs.twimg.com/media/Em9rmwsXEAQJRHN.jpg;;;;;;;[];;;;
1,32833E+18;1,32833E+18;2020-11-16 14:42:40 Střední Evropa (běžný čas);16.11.2020;14:42:40;200;1,31318E+18;trepkaprvokoff;t̆̈r̆̈ĕ̈p̆̈k̆̈ă̈ȏ̈f̑̈f̑̈;;Sestra: kde ses  Ja: na zachode Sestra: ty kadis? Ja: jo Sestra: ja ti chtela ukazat kone ale ty mas koronavirus protoze moc kadis  Ja: 😳😳;cs;[];[];[];1;0;11;[];[];https://twitter.com/trepkaprvokoff/status/1328332662411579392;NEPRAVDA;;0;;;;;;;;[];;;;
1,32831E+18;1,32795E+18;2020-11-16 12:54:26 Střední Evropa (běžný čas);16.11.2020;12:54:26;200;1,14236E+18;vhoboj;Viliboy na hoboj;;@RudolfStryc @janklusacek @BlanikZ Válka proti řidičům Rozloučení s koronavirem na K.mostě Mezinarodní válčení s čínou Návrh na kontroly elektroměrů🙄 Je to Magor, co dělá všechno, jen ne to co má. Mě to teda nevadí, páč do centra moc nejezdím a ostatnímu se směju, jak podřezává větev pod piráty..😆;cs;[];[];[];1;0;0;[];[];https://twitter.com/VHoboj/status/1328305423850606597;NEPRAVDA;;0;;;;;;;;[{'screen_name': 'RudolfStryc', 'name': 'Rudolf Strýc', 'id': '875244476184358912'}, {'screen_name': 'janklusacek', 'name': 'Jan Klusáček 🇺🇦', 'id': '174301068'}, {'screen_name': 'BlanikZ', 'name': 'Radovan Vávra', 'id': '3003612837'}];;;;
1,32827E+18;1,32827E+18;2020-11-16 10:42:23 Střední Evropa (běžný čas);16.11.2020;10:42:23;200;18119494;zasevtom;Tomáš;;na farmářských trzích jsem koupil jablka a ředkvičky, trhovec řekl 94 Kč, řekl jsem, že podle váhy by to mělo být max 87 Kč a on řekl „vždyť jsem vám to říkal“ a platil jsem 87 Kč - krade se i za korony… 😱;cs;[];[];[];1;0;2;[];[];https://twitter.com/zasevtom/status/1328272191310409728;NEPRAVDA;;0;;;;;;;;[];;;;
1,32827E+18;1,32823E+18;2020-11-16 10:29:18 Střední Evropa (běžný čas);16.11.2020;10:29:18;200;1,01158E+18;skutecnym;Skutečný mimozemšťan;;@RouskaE @ZdravkoOnline čaulidi, tyvle, 132 testovaných za den je víc než počet zamřelých s koronavirem nebo menší? 🤔  Já nevím soudruzi, ale tyhle magie s číslama vysmažených guru Márů patřících estébákovi @AndrejBabis jsou už kurevsky unavný. Andrej a jeho parta z Agrofertu posrala co mohla. 😬;cs;[{'screen_name': 'andrejbabis', 'name': 'andrej babiš', 'id': '713035525'}];[];[];0;0;2;[];[];https://twitter.com/SkutecnyM/status/1328268899360583680;NEPRAVDA;;0;;;;;;;;[{'screen_name': 'RouskaE', 'name': 'eRouška', 'id': '1245705997840257024'}, {'screen_name': 'ZdravkoOnline', 'name': 'Ministerstvo zdravotnictví', 'id': '3293937255'}];;;;
1,32809E+18;1,32807E+18;2020-11-15 22:18:37 Střední Evropa (běžný čas);15.11.2020;22:18:37;200;1,22444E+18;321blok;lukas;;@spimnebojim do konce roku nevim jestli vubec, protoze korona 😱😖;cs;[];[];[];1;0;1;[];[];https://twitter.com/321blok/status/1328085017109667846;NEPRAVDA;;0;;;;;;;;[{'screen_name': 'spimnebojim', 'name': 'prdím a smrdím', 'id': '1142090065725857793'}];;;;
1,32802E+18;1,32802E+18;2020-11-15 18:03:00 Střední Evropa (běžný čas);15.11.2020;18:03:00;200;3057150651;newsroomct24;Newsroom ČT24;;Když se necháte očkovat proti koronaviru, proměníte se v opici 🙊  I takové mystifikace se šíří. Tuhle konkrétně vysílala ruská státní televize Rossija 1 🇷🇺 Hoaxům okolo nemoci Covid-19 se budeme věnovat v dnešním dílu Newsroomu, tak se nezapomeňte dívat❗️ 22:10, ČT24 📺  https://t.co/XfteBwgy0F;cs;[];[];[];1;0;5;[];[];https://twitter.com/NewsroomCT24/status/1328020688842747904;NEPRAVDA;;1;https://pbs.twimg.com/ext_tw_video_thumb/1327271800074612736/pu/img/VuF-Z9yLBOQ6nsAu.jpg;;;;;;;[];;;;
1,32801E+18;1,32798E+18;2020-11-15 17:10:27 Střední Evropa (běžný čas);15.11.2020;17:10:27;200;7,93904E+17;divozinka;Divožena Sudetská;;@JanSlezk5 @fipa Jenomže ono když jsi zvyklý celý život 1-2x týdně plavat, a pak ti kvůli koroně zavřou bazény, tak ti nic jiného nezbyde, než si zvyknout na studenou 😞;cs;[];[];[];1;0;3;[];[];https://twitter.com/divozinka/status/1328007463002640384;NEPRAVDA;;0;;;;;;;;[{'screen_name': 'JanSlezk5', 'name': 'Jan Slezák', 'id': '1457990060037525505'}, {'screen_name': 'fipa', 'name': 'Filip Molčan', 'id': '13110582'}];;;;
1,32792E+18;1,32791E+18;2020-11-15 11:20:08 Střední Evropa (běžný čas);15.11.2020;11:20:08;200;1,31523E+18;xicask1;xica;;"@Bazilis Skoro trefa do černého ;) - Při zachování současných protiepidemických opatření se Česko pod 1000 nových případů koronaviru denně dostane zhruba 14. prosince, řekl exministr zdravotnictví Roman Prymula v televizi Prima.   Hurá nakupovat!!!! 😞";cs;[];[];[];1;0;4;[];[];https://twitter.com/xicask1/status/1327919304185143298;NEPRAVDA;;0;;;;;;;;[{'screen_name': 'Bazilis', 'name': 'Bazilíšek / 🧨 cook off every russian tank /', 'id': '84260553'}];;;;
1,32774E+18;1,32771E+18;2020-11-14 23:23:34 Střední Evropa (běžný čas);14.11.2020;23:23:34;200;415586380;michalovamichle;Michal z Michle 🪁;;@MaykazGurunu Koronavirus roznáší 👻 👻 a kostlivci ve skříni? Tak to chápu, proč je ho všude kolem tolik.;cs;[];[];[];0;0;1;[];[];https://twitter.com/michalovamichle/status/1327738976132866049;NEPRAVDA;;0;;;;;;;;[{'screen_name': 'MaykazGurunu', 'name': 'Mayka z Gurunu 🌪️', 'id': '757131754851500032'}];;;;
1,32757E+18;1,32757E+18;2020-11-14 12:27:37 Střední Evropa (běžný čas);14.11.2020;12:27:37;200;1,29782E+18;dzumpeeer;Vít;;Kéž by nový rok znamenal opravdu nový rok bez korony 😞;cs;[];[];[];1;0;1;[];[];https://twitter.com/Dzumpeeer/status/1327573898171453440;NEPRAVDA;;0;;;;;;;;[];;;;
1,3274E+18;1,32739E+18;2020-11-14 00:45:05 Střední Evropa (běžný čas);14.11.2020;0:45:05;200;1,30476E+18;hug4sylvee;eli/ocean¹⁴³💙💛JULES DAY;;@helloluvitsjohy @justboringmeh @ada_smrdi pokud vam bude po korone 15 16 mne bude 19 20😳;cs;[];[];[];5;0;2;[];[];https://twitter.com/hug4sylvee/status/1327397101945450497;NEPRAVDA;;0;;;;;;;;[{'screen_name': 'ada_smrdi', 'name': 'ada', 'id': '1279151143709487104'}];;;;
1,32732E+18;1,32732E+18;2020-11-13 19:54:32 Střední Evropa (běžný čas);13.11.2020;19:54:32;200;1,11416E+18;rsfrankfurt;rsfrankfurt;;@JMalacova Devčico, důchodci (a státní sprava) jsou jediní, kdo má behem koronaviru penize jiste, ale to taky asi z hlavy vypadlo, jak ji furt teatralne nakláníš na stranu! 💩;cs;[];[];[];1;0;4;[];[];https://twitter.com/rsfrankfurt/status/1327323980320137216;NEPRAVDA;;0;;;;;;;;[{'screen_name': 'JMalacova', 'name': 'Jana Maláčová ❤️🍄', 'id': '1023829198576726016'}];;;;
1,32732E+18;1,32732E+18;2020-11-13 19:26:59 Střední Evropa (běžný čas);13.11.2020;19:26:59;200;1,32703E+18;_tazamilovana;🥺✨;;Twl už mě vážně štve ta korona furt samý opatření...😒;cs;[];[];[];0;0;0;[];[];https://twitter.com/_tazamilovana/status/1327317050369470464;NEPRAVDA;;0;;;;;;;;[];;;;
1,3273E+18;1,32728E+18;2020-11-13 18:22:03 Střední Evropa (běžný čas);13.11.2020;18:22:03;200;2792059170;macura2014;Tomáš Macura;;@luba_z_mesta @vpar2 Přes významný pokles příjmů města kvůli koroně a z toho vyplývající nutná úsporná opatření mohu s přiměřenou mírou jistoty zaručit, že na MHD v Ostravě půjde příští rok opět absolutně více peněz, než letos. Byť ne úplně tolik, kolik by si @DPOstrava přál😊;cs;[{'screen_name': 'dpostrava', 'name': 'dp ostrava', 'id': '801845169763008512'}];[];[];1;0;3;[];[];https://twitter.com/Macura2014/status/1327300708257980418;NEPRAVDA;;0;;;;;;;;[{'screen_name': 'luba_z_mesta', 'name': 'Lubomír Fridrich', 'id': '3405572176'}, {'screen_name': 'vpar2', 'name': 'Vaclav Parchansky', 'id': '1482544980'}];;;;
1,3272E+18;1,32719E+18;2020-11-13 11:26:41 Střední Evropa (běžný čas);13.11.2020;11:26:41;200;1307861238;andrejlobotka;Andrej Lobotka;;"@RadekNohl Jj, ať žije ""Copy &amp; Paste""! 😂 Na ministerstvu a ve vládě hodně oblíbený při odůvodňování většiny opatření proti koronaviru...Bohužel!";cs;[];[];[];0;0;0;[];[];https://twitter.com/AndrejLobotka/status/1327196176584728576;NEPRAVDA;;0;;;;;;;;[{'screen_name': 'RadekNohl', 'name': 'Radek Nohl', 'id': '191011637'}];;;;
1,32715E+18;1,32715E+18;2020-11-13 08:42:39 Střední Evropa (běžný čas);13.11.2020;8:42:39;200;7,09391E+17;jiristefek;Jiří Štefek;;"""Nedostatek operátorů byl způsoben tím, že se vláda spoléhala na vlastní zdroje...."" V této větě je řečeno asi vše 🙈🙊🙆‍♀️ https://t.co/8KlBEdzZBn @iROZHLAScz #trasovani #COVIDー19 #bestincovid #koronavirus #CzechRepublic";cs;[{'screen_name': 'irozhlascz', 'name': 'irozhlas.cz', 'id': '70725936'}];['https://www.irozhlas.cz/zpravy-domov/koronavirus-cesko-v-cesku-cr-chytra-karantena_2011130600_ako'];[];0;0;0;['trasovani', 'covidー19', 'bestincovid', 'koronavirus', 'czechrepublic'];[];https://twitter.com/JiriStefek/status/1327154897331113984;NEPRAVDA;;0;;;;;;;;[];;;;
1,32715E+18;1,32715E+18;2020-11-13 08:38:27 Střední Evropa (běžný čas);13.11.2020;8:38:27;200;1316022847;_sukovf;Martin Souček;;"@Posledniskaut Dovedeš si představit, že by se příští rok před volbami říkalo, že za Babiše vůbec poprvé ""nebyly"" Vánoce 😂? Mnohem líp bude přece znít ""naše vláda vám jako první po koronaviru dala Vánoce.""";cs;[];[];[];4;0;25;[];[];https://twitter.com/_sukovf/status/1327153839133351943;NEPRAVDA;;0;;;;;;;;[{'screen_name': 'Posledniskaut', 'name': 'Poslední skaut™', 'id': '884811990'}];;;;
1,32698E+18;1,32696E+18;2020-11-12 21:22:46 Střední Evropa (běžný čas);12.11.2020;21:22:46;200;488803262;nensyrfc;Gospodja 🤣🙄🤷🏻‍♀️😈;;@faktorxy mozda te nece korona, al zato te hoce kenguri i maloletnici 😂🤣😋❤️;cs;[];[];[];1;0;1;[];[];https://twitter.com/NensyRFC/status/1326983799910096896;NEPRAVDA;;0;;;;;;;;[{'screen_name': 'faktorxy', 'name': 'Грешкууу у делиријуму🦘', 'id': '3462517462'}];;;;
1,32698E+18;1,32698E+18;2020-11-12 21:18:49 Střední Evropa (běžný čas);12.11.2020;21:18:49;200;1,05503E+18;silenazajicova;Zajícová;;Padesát odstínů korony 🤦😂😂  https://t.co/Il7sgEp71W;cs;[];['https://youtu.be/wGyW8VaInw0'];[];1;0;3;[];[];https://twitter.com/SilenaZajicova/status/1326982805113409537;NEPRAVDA;;0;;;;;;;;[];;;;
1,32698E+18;1,32698E+18;2020-11-12 21:07:55 Střední Evropa (běžný čas);12.11.2020;21:07:55;200;8,37325E+17;luxury_prague;LP-Life.cz;;💥 NA FÉROVKU: Singles mají problém 🙊👇🏻  https://t.co/r6qG5EO8vu  #naferovku #lplifeonline #seznamovani #dating #coronavirus #koronavirus #covid #laska #par #love #couple #magazine #inspiration #news #lplifecz (Credit: Pixabay)  https://t.co/L8WEH8IkyB;cs;[];['https://www.lp-life.cz/na-ferovku-singles-maji-problem'];['https://pbs.twimg.com/media/EmphVMYXcAA4bRR.jpg'];0;0;1;['naferovku', 'lplifeonline', 'seznamovani', 'dating', 'coronavirus', 'koronavirus', 'covid', 'laska', 'par', 'love', 'couple', 'magazine', 'inspiration', 'news', 'lplifecz'];[];https://twitter.com/Luxury_Prague/status/1326980060360953859;NEPRAVDA;;1;https://pbs.twimg.com/media/EmphVMYXcAA4bRR.jpg;;;;;;;[];;;;
1,32697E+18;1,32697E+18;2020-11-12 20:16:18 Střední Evropa (běžný čas);12.11.2020;20:16:18;200;7,12234E+17;ceskova_jana;jana češkova;;Děkuji a prosím!😇🍀🌹 Navzdory úspěšně zvládnuté první vlně koronaviru bylo Česko v posledních 2 měsících kvůli rekordním číslům spíše odstrašujícím příkladem. Vrací se s COVIDEM mezi premianty.! Reprodukční číslo kleslo na 0,8 a v tomto ukazateli patří Česko v Evropě mezi TOP!;cs;[];[];[];5;1;20;[];[];https://twitter.com/ceskova_jana/status/1326967073935908869;NEPRAVDA;;0;;;;;;;;[];;;;
1,32695E+18;1,32695E+18;2020-11-12 19:26:15 Střední Evropa (běžný čas);12.11.2020;19:26:15;200;1,17406E+18;mannedtweets;Crewed Spaceflights Tweets;;#koronavirusvČesku 🇨🇿😷 Koronavirus v Olomouckém kraji.  #dobrézprávy;cs;[];[];[];0;0;0;['koronavirusvčesku', 'dobrézprávy'];[];https://twitter.com/MannedTweets/status/1326954476339597318;NEPRAVDA;https://twitter.com/marian_hajduch/status/1326930782783410176;0;;;;;;;;[];;;;
1,3269E+18;1,3269E+18;2020-11-12 15:48:25 Střední Evropa (běžný čas);12.11.2020;15:48:25;200;8,06832E+17;ajtyodbornik;AjTy(ne)Odbornik;;Epidemie virové myxomatózy. Mladou Boleslav sužují mrtví králíci v ulicích!  Příliš se s tím dělat nedá. Králíci jsou tady přemnožení a sama příroda takto reguluje jejich počty. Hned pod tím titulek: Onemocněli jste koronavirem? 😱 #znasehotisku 😂😂;cs;[];[];[];5;1;26;['znasehotisku'];[];https://twitter.com/AjTyOdbornik/status/1326899658204057600;NEPRAVDA;;0;;;;;;;;[];;;;
1,32687E+18;1,32687E+18;2020-11-12 13:46:57 Střední Evropa (běžný čas);12.11.2020;13:46:57;200;7,54732E+17;dadulkarusalka;Rusalka🇨🇿🇸🇰☀️;;Rozsekalo! Padesát odstínů korony. 😂😂 https://t.co/BiIA2XEb7P;cs;[];['https://www.facebook.com/100001304264570/posts/3408944309159011/?app=fbl'];[];4;1;17;[];[];https://twitter.com/DadulkaRusalka/status/1326869087910309888;NEPRAVDA;;0;;;;;;;;[];;;;
1,32685E+18;1,32684E+18;2020-11-12 12:30:12 Střední Evropa (běžný čas);12.11.2020;12:30:12;200;327241857;virus_3000;Virus3k;;@WukinaJ Ti říkám, že korona je černá ovce rodiny, nebavíme se s ní a tak... 😂;cs;[];[];[];1;0;1;[];[];https://twitter.com/Virus_3000/status/1326849776105779201;NEPRAVDA;;0;;;;;;;;[{'screen_name': 'WukinaJ', 'name': 'Liščí bůh', 'id': '2166687905'}];;;;
1,32683E+18;1,32683E+18;2020-11-12 11:28:45 Střední Evropa (běžný čas);12.11.2020;11:28:45;200;1,17406E+18;mannedtweets;Crewed Spaceflights Tweets;;#koronavirusvČesku 🇨🇿😷 Koronavirus v Olomouckém kraji.;cs;[];[];[];0;0;0;['koronavirusvčesku'];[];https://twitter.com/MannedTweets/status/1326834311149080579;NEPRAVDA;https://twitter.com/Nem_Sumperk/status/1326829116113514496;0;;;;;;;;[];;;;
1,32683E+18;1,32683E+18;2020-11-12 11:27:43 Střední Evropa (běžný čas);12.11.2020;11:27:43;200;1,17406E+18;mannedtweets;Crewed Spaceflights Tweets;;#koronavirusvČesku 🇨🇿😷 Koronavirus v Moravskoslezském kraji aktuálně.;cs;[];[];[];0;0;0;['koronavirusvčesku'];[];https://twitter.com/MannedTweets/status/1326834051752337409;NEPRAVDA;https://twitter.com/ivondrak/status/1326832876546088960;0;;;;;;;;[];;;;
1,3268E+18;1,3268E+18;2020-11-12 09:32:00 Střední Evropa (běžný čas);12.11.2020;9:32:00;200;707345563;radiozurnal1;Radiožurnál;;💕 Péče o pacienty s koronavirem není jen o práci lékařů a zdravotních sester. Důležitou roli mají také ošetřovatelé. Jak vám ukážeme v dalším díle seriálu V první linii, ošetřovatelka Lucie Repáňová dokáže i lidem ve vážném stavu zlepšit náladu. ➡️  https://t.co/i0jfpvhRlx  https://t.co/x6LJjPfVW2;cs;[];['http://rozhl.as/48s'];[];0;1;6;[];[];https://twitter.com/Radiozurnal1/status/1326804927511977984;NEPRAVDA;;1;https://pbs.twimg.com/amplify_video_thumb/1326575141929820161/img/LvsLFPRMY5yNjNub.jpg;;;;;;;[];;;;
1,32663E+18;1,32663E+18;2020-11-11 21:56:36 Střední Evropa (běžný čas);11.11.2020;21:56:36;200;1,20718E+18;namjinsbabygrrl;ia🐣anu⁷older sis☀|SEOKJINNIE CULT|;;@gguksaphrodite POCKY ALE ME NA NI VADI JEN SMRAD A JAK NECITIM PO KORONE TAK BY MI CHUTNALA 😭😭😭;cs;[];[];[];0;0;0;[];[];https://twitter.com/namjinsbabygrrl/status/1326629927211425795;NEPRAVDA;;0;;;;;;;;[];;;;
